,Unnamed: 0,Company,Name Gara,Address,Phone,Province,Brand,Liên kết
3089,3170,Công ty TNHH Bá Thành - CN 2,Công ty TNHH Bá Thành - CN 2,"27 Nguyễn Kiệm, P.3, Q.Gò Vấp, TP.HCM",0908 751 765,Tp Hcm,Multibrand,Phú Hưng
3090,3171,Công ty TNHH MTV Ô Tô Kim,Công ty TNHH MTV Ô Tô Kim,"30B Nguyễn Thị Định, P.An Phú, Q.2, TP.HCM",028 3505 9256,Tp Hcm,Multibrand,Phú Hưng
3091,3172,Công ty TNHH Sửa chữa Ô Tô Thành Chung,Công ty TNHH Sửa chữa Ô Tô Thành Chung,"14 – 16 Phan Đăng Lưu, P.6, Q.Bình Thạnh, TP.HCM",028 3551 1921,Tp Hcm,Multibrand,Phú Hưng
3092,3173,Công ty TNHH Ô Tô Minh Nguyệt,Công ty TNHH Ô Tô Minh Nguyệt,"722 Điện Biên Phủ, P.22, Q.Bình Thạnh, TP.HCM",028 3512 7269,Tp Hcm,Multibrand,Phú Hưng
3093,3174,Công ty Cổ phần Tân Thành Đô City FORD,FORD,"218 Quốc lộ 13, P.Hiệp Bình Chánh, Q.Thủ Đức, TP.HCM",2253668995,Tp Hcm,Ford,Phú Hưng
3094,3175,Công ty TNHH TMDV - XNK Ô Tô Gia Phát,Công ty TNHH TMDV - XNK Ô Tô Gia Phát,"151/4A Điện Biên Phủ,P.25, Q.Bình Thạnh, TP.HCM",028 3512 8328,Tp Hcm,Multibrand,Phú Hưng
3095,3176,SUZUKI Đại Việt,SUZUKI Đại Việt,"438-440 Nguyễn Duy Trinh, P.Bình Trưng Đông, Q.2, TP.HCM",028 3840 5289,Tp Hcm,Suzuki,Phú Hưng
3096,3177,Công ty TNHH TMDV Ô Tô Quốc Cường,Công ty TNHH TMDV Ô Tô Quốc Cường,"C18/13 Ấp 4B, Xã Bình Hưng, H.Bình Chánh, TP.HCM",028 5431 6288,Tp Hcm,Multibrand,Phú Hưng
3097,3178,Công ty Cổ phần Vân Nam,Công ty Cổ phần Vân Nam,"522 Quốc lộ 13, KP6, P.Hiệp Bình Phước, Q.Thủ Đức, TP.HCM",028 3727 0983,Tp Hcm,Multibrand,Phú Hưng
3098,3179,Xí nghiệp Công nghiệp và Dịch vụ Ô Tô ISAMCO Bình Triệu,Xí nghiệp Công nghiệp và Dịch vụ Ô Tô ISAMCO Bình Triệu,"79-81 Quốc Lộ 13, P.Hiệp Bình Chánh, Q.Thủ Đức, TP.HCM",028 3726 9446,Tp Hcm,Multibrand,Phú Hưng
3099,3180,Xí nghiệp Công nghiệp và DV Ô Tô ISAMCO Cô Giang,Xí nghiệp Công nghiệp và DV Ô Tô ISAMCO Cô Giang,"139 Cô Giang, P.Cô Giang, Q.1, TP.HCM",028 3920 0105,Tp Hcm,Multibrand,Phú Hưng
3100,3181,Công ty TNHH Hoàng Xa,Công ty TNHH Hoàng Xa,"85 Hoàng Quốc Việt, P.Phú Thuận, Q.7, TP.HCM",028 5433 9382,Tp Hcm,Multibrand,Phú Hưng
3101,3182,Công ty CP Cơ khí Lâm nghiệp Sài Gòn,Công ty CP Cơ khí Lâm nghiệp Sài Gòn,"7 Hẻm số 7 Thành Thái, P.14, Q.10, TP.HCM",028 3865 5609,Tp Hcm,Multibrand,Phú Hưng
3102,3183,Công ty TNHH MTV Thịnh Ô Tô,Công ty TNHH MTV Thịnh Ô Tô,"75-77H Trần Văn Kiểu, P.10, Q.6, TP.HCM",028 3755 8275,Tp Hcm,Multibrand,Phú Hưng
3103,3184,Công ty CP Kĩ thuật và Ô Tô Trường Long,Công ty CP Kĩ thuật và Ô Tô Trường Long,"Lô 46, Đường số 3, KCN Tân Tạo, Q.Bình Tân, TP.HCM",028 3754 3188,Tp Hcm,Multibrand,Phú Hưng
3104,3185,Công ty CP Cơ khí Ô Tô Thủ Đức (SAMCO Thủ Đức),SAMCO Thủ Đức,"1 Xa Lộ Hà Nội, P.Hiệp Phú, Q.9, TP.HCM",0(08) 37308989,Tp Hcm,Multibrand,Phú Hưng
3105,3186,Công ty TNHH Cơ khí Ô Tô Phú Cường,Công ty TNHH Cơ khí Ô Tô Phú Cường,"39A Gò Dưa, P.Tam Bình, Q.Thủ Đức, TP.HCM",028 6284 9648,Tp Hcm,Multibrand,Phú Hưng
3106,3187,Công ty TNHH Ô Tô Minh Phát,Công ty TNHH Ô Tô Minh Phát,"53/6A Phạm Văn Chiêu, P.14, Q.Gò Vấp, TP.HCM",028 6257 9194,Tp Hcm,Multibrand,Phú Hưng
3107,3188,Công ty TNHH DV-TM Ô Tô Anh Đức,Công ty TNHH DV-TM Ô Tô Anh Đức,"220 Lê Văn Lương, P.Tân Hưng, Q.7, TP.HCM",0126 838 3838,Tp Hcm,Multibrand,Phú Hưng
3108,3189,Công ty CP TMDV TOYOTA An Thành,TOYOTA An Thành,"606 Trần Hưng Đạo, P.2, Q.5, TP.HCM",0839.230.860,Tp Hcm,Toyota,Phú Hưng
3109,3190,Công ty CP Ô Tô Trí Linh,Công ty CP Ô Tô Trí Linh,"30/43 Lâm Văn Bền, P.Tân Kiểng, Q.7, TP.HCM",028 3775 4491,Tp Hcm,Multibrand,Phú Hưng
3110,3191,Công ty TNHH Ô Tô Thế Giới,Công ty TNHH Ô Tô Thế Giới,"Lô B1, Đường C2, KCN Cát Lái 2, P.Thạnh Mỹ Lợi, Q.2, TP.HCM",028 3716 6688 | 0909 362 486,Tp Hcm,Multibrand,Phú Hưng
3111,3192,Công ty TNHH Hình Tượng Ô Tô Sài Gòn (SUBARU),SUBARU,"106 Nguyễn Văn Trỗi, P.8, Q.Phú Nhuận, TP.HCM",0839.210.389,Tp Hcm,Subaru,Phú Hưng
3112,3193,Công ty TNHH Sửa chữa Ô Tô Sài Gòn,Công ty TNHH Sửa chữa Ô Tô Sài Gòn,"591 Điện Biên Phủ, P.25, Q.Bình Thạnh, TP.HCM",028 3899 6420,Tp Hcm,Multibrand,Phú Hưng
3113,3194,Công ty CP Vận tải Hàng Không Việt Nam (NISSAN Tân Sơn Nhất),NISSAN Tân Sơn Nhất,"1A Hồng Hà, P.2, Q.Tân Bình, TP.HCM",028 6660 1668 | 028 6660 1168,Tp Hcm,Nissan,Phú Hưng
3114,3195,Công ty TNHH TV-TM & DV Ô Tô Hoàng Gia,Công ty TNHH TV-TM & DV Ô Tô Hoàng Gia,"765 Trường Chinh, P.Tây Thạnh, Q.Tân Phú, TP.HCM",028 3815 8068 | 028 3815 0468,Tp Hcm,Multibrand,Phú Hưng
3115,3196,Công ty TNHH DV - TM Bách Tâm,Công ty TNHH DV - TM Bách Tâm,"261A Lâm Văn Bền, P.Bình Thuận, Q.7, TP.HCM",028 6271 4088,Tp Hcm,Multibrand,Phú Hưng
3116,3197,Công ty TNHH Cơ khí Ô Tô Minh Đức,Công ty TNHH Cơ khí Ô Tô Minh Đức,"106/10 Điện Biên Phủ, P.17, Q.Bình Thạnh, TP.HCM",028 3509 9989,Tp Hcm,Multibrand,Phú Hưng
3117,3198,Công ty TNHH MTV TMDV Liên Thông,Công ty TNHH MTV TMDV Liên Thông,"46 Hiệp Bình, P.Hiệp Bình Chánh, Q.Thủ Đức, TP.HCM",028 5403 9458 | 0932 693 594,Tp Hcm,Multibrand,Phú Hưng
3118,3199,Garage Tân Hoàng Liêm,Garage Tân Hoàng Liêm,"327B Lê Hồng Phong, P.2, Q.10, TP.HCM",028 3835 1492,Tp Hcm,Multibrand,Phú Hưng
3119,3200,Công ty TNHH Đắc Yến,Công ty TNHH Đắc Yến,"403 Tô Ngọc Vân, P.Thạnh Xuân, Q.12, TP.HCM",028 2215 6122 | 0908 068 083,Tp Hcm,Multibrand,Phú Hưng
3120,3201,Công ty CP Ô Tô Nam Đô,Công ty CP Ô Tô Nam Đô,"32 Hà Huy Giáp, P.Thạnh Lộc, Q.12, TP.HCM",028 3500 8779,Tp Hcm,Multibrand,Phú Hưng
3121,3202,Công ty CP TMDV Sửa chữa Ô Tô Phúc Lộc,Công ty CP TMDV Sửa chữa Ô Tô Phúc Lộc,"2/3 Trường Chinh, KP4, P.Tân Thới Nhất, Q.12, TP.HCM",028 6255 8017,Tp Hcm,Multibrand,Phú Hưng
3122,3203,Công ty TNHH TM & DV-KT Hưng Thịnh Phát,Công ty TNHH TM & DV-KT Hưng Thịnh Phát,"3 Dương Văn An, P.An Phú, Q.2, TP.HCM",0903 931 607,Tp Hcm,Multibrand,Phú Hưng
3123,3204,Công ty CP Ô Tô Kim Thanh,Công ty CP Ô Tô Kim Thanh,"6 Đường 3/2, P.15, Q.11, TP.HCM",028 3866 2222,Tp Hcm,Multibrand,Phú Hưng
3124,3205,Công ty TNHH Ô Tô Tiên Phong,Công ty TNHH Ô Tô Tiên Phong,"66 Phổ Quang, P.2, Q.Tân Bình, TP.HCM",028 3997 9913 | 0909 755 400,Tp Hcm,Multibrand,Phú Hưng
3125,3206,Công ty CP Đầu Tư TM AMC Khánh Hội,Công ty CP Đầu Tư TM AMC Khánh Hội,"155A Nguyễn Tất Thành, P.18, Q.4",028 3941 1962,Tp Hcm,Multibrand,Phú Hưng
3126,3207,Công ty TNHH Ô Tô Minh Phương,Công ty TNHH Ô Tô Minh Phương,"297A Ung Văn Khiêm, phường 25, Q.Bình Thạnh, TP.HCM",0902 302 538,Tp Hcm,Multibrand,Phú Hưng
3127,3208,Công ty CP TMDV XNK Kim Bảo Group,Công ty CP TMDV XNK Kim Bảo Group,"S17-18 Đường M1, P.Bình Hưng Hòa, Q.Bình Tân",028 6274 4486,Tp Hcm,Multibrand,Phú Hưng
3128,3209,Công ty TNHH TMDV KT Hưng Thịnh Phát,Công ty TNHH TMDV KT Hưng Thịnh Phát,"3 Dương Văn An, P.An Phú, Q.2, TP.HCM",0903 931 607,Tp Hcm,Multibrand,Phú Hưng
3129,3210,Công ty TNHH TMDV Ôtô Phương Bảo Minh,Công ty TNHH TMDV Ôtô Phương Bảo Minh,"375 - 377 Tây Thạnh, P.Tây Thạnh, Q.Tân Phú, TP.HCM",0987 777 345,Tp Hcm,Multibrand,Phú Hưng
3130,3211,Công ty TNHH TM DV Autos Only,Công ty TNHH TM DV Autos Only,"276 Nguyễn Văn Linh, P.Bình Thuận, Q.7, TP.HCM",0909 331 217,Tp Hcm,Multibrand,Phú Hưng
3131,3212,Chi nhánh Long Biên Công ty TNHH Ô Tô Ngôi Sao Việt Nam,Chi nhánh Long Biên Công ty TNHH Ô Tô Ngôi Sao Việt Nam,"Lô D5-1, KCN Hà Nội - Đài Tư, 386 Nguyễn Văn Linh, Q.Long Biên, TP.Hà Nội",024 3875 8999 | 024 3875 9000,Hà Nội,Multibrand,Phú Hưng
3132,3213,Công ty Cổ phần Ô Tô Thành An,Công ty Cổ phần Ô Tô Thành An,"Tổ 24, Thị trấn Đông Anh, Huyện Đông Anh,TP.Hà Nội",024 3685 8989,Hà Nội,Multibrand,Phú Hưng
3133,3214,Công ty TNHH SX - DVTM Bảo Long,Công ty TNHH SX - DVTM Bảo Long,"2 Đại Lộ Bình Dương, KP Trung, P.Vĩnh Phú, TX.Thuận An, Tỉnh Bình Dương",0274 0378 6781,Hà Nội,Multibrand,Phú Hưng
3134,3215,FORD Bình Dương,FORD Bình Dương,"Lô C13 Đường Hùng Vương, Khu Liên hợp, P.Hòa Phú, Tỉnh Bình Dương",0274 380 1381,Bình Dương,Ford,Phú Hưng
3135,3216,Garage Sài Gòn Kim Tín,Garage Sài Gòn Kim Tín,"35B Quốc Lộ 13, KP Hòa Long, P.Lái Thiêu, TX.Thuận An, Bình Dương",0907 749 888 | 0908 496 977,Bình Dương,Multibrand,Phú Hưng
3136,3217,Công ty TNHH TM&DV Cường Thành Công,Công ty TNHH TM&DV Cường Thành Công,"Lô 60A8, KDC Khuê Trung Đò Xu, Hòa Cường, P.Khuê Trung, Q.Cẩm Lệ, Đà Nẵng",0123 411 4468,Đà Nẵng,Multibrand,Phú Hưng
3137,3218,Công ty TNHH MTV TMDV Tuấn Lê,Công ty TNHH MTV TMDV Tuấn Lê,"Tổ 32 Khu Cầu Xéo, TT.Long Thành, Tỉnh Đồng Nai",0251 352 4114,Đồng Nai,Multibrand,Phú Hưng
3138,3219,Ô Tô Đồng Nai,Ô Tô Đồng Nai,"18A Đường 3A, KCN Biên Hòa 2, TP.Biên Hòa, Tỉnh Đồng Nai",0251 383 3939,Đồng Nai,Multibrand,Phú Hưng
3139,3220,Công ty TNHH DVTM Ô Tô Đạt Tấn Phát,Công ty TNHH DVTM Ô Tô Đạt Tấn Phát,"795 Xa lộ Hà Nội, P.Long Bình, TP.Biên Hòa, Tỉnh Đồng Nai",0251 389 3288,Đồng Nai,Multibrand,Phú Hưng
3140,3221,Công Ty TNHH Ô Tô Bắc Quang,Công Ty TNHH Ô Tô Bắc Quang,"Khu Công Nghiệp Biên Hòa 1, Đường 1, P.An Bình, TP.Biên Hòa, Tỉnh Đồng Nai",0251 3835 531 | 0251 3932 368,Đồng Nai,Multibrand,Phú Hưng
3141,3222,Công ty TNHH MTV Tâm Nhi,Công ty TNHH MTV Tâm Nhi,"25/91, KP 13, P.Hố Nai, TP.Biên Hòa, Tỉnh Đồng Nai",0985 289 767,Đồng Nai,Multibrand,Phú Hưng
3142,3223,Ô Tô Kim Thu,Ô Tô Kim Thu,"61 Đường 3/2, Q.Ninh Kiều, TP.Cần Thơ",0292 383 8119,Cần Thơ,Multibrand,Phú Hưng
3143,3224,Công ty TNHH MTV Hiền 68,Công ty TNHH MTV Hiền 68,"74 Đường 3/2, P.Xuân Khánh, Q.Ninh Kiều, TP.Cần Thơ",0292 383 1255,Cần Thơ,Multibrand,Phú Hưng
3144,3225,Công ty TNHH DV Ô Tô Ninh Kiều,Công ty TNHH DV Ô Tô Ninh Kiều,"342/10 Ấp Lợi Nguyên B, P.An Khánh, Q.Ninh Kiều, TP.Cần Thơ",0292 389 2569,Cần Thơ,Multibrand,Phú Hưng
3145,3226,Cơ Sở Sửa Chữa Ô Tô Thái Tín,Cơ Sở Sửa Chữa Ô Tô Thái Tín,"91/62, CMT8, P.An Thới, H.Bình Thủy, TP.Cần Thơ",0939 060 246,Cần Thơ,Multibrand,Phú Hưng
3146,3227,Trạm dịch vụ Western Ford An Giang,Ford An Giang,"42A Q91, P. Mỹ Thới, Tp Long Xuyên, An Giang",2963933101,An Giang,Ford,Bảo Việt
3147,3228,Chi nhánh Gentraco An Giang,Chi nhánh Gentraco An Giang,"43/12 QL91 Trần Hưng Đạo, P. Mỹ Thới, Tp. Long Xuyên, An Giang",,An Giang,Multibrand,Bảo Việt
3148,3229,Kia Tân Thái Dương,Kia Tân Thái Dương,"46 Trần Hưng Đạo, P.Mỹ Thới, TP.Long Xuyên, An Giang",,An Giang,Kia,Bảo Việt
3149,3230,Công ty Cơ khí An Giang,Công ty Cơ khí An Giang,"Số 28/1 Trần Hưng Đạo, P. Mỹ Quý, Tp. Long Xuyên, An Giang",,An Giang,Multibrand,Bảo Việt
3150,3231,Chi nhánh An Giang - Công ty CP Ô tô Trường Hải,Chi nhánh An Giang - Công ty CP Ô tô Trường Hải,"Số 46 Trần Hưng Đạo, P. Mỹ Thới, Tp. Long Xuyên, An Giang",,An Giang,Multibrand,Bảo Việt
3151,3232,CN Cty CP Cơ Khí An Giang,CN Cty CP Cơ Khí An Giang,"28/1 Trần Hưng Đạo, P Mỹ Quý, TP Long Xuyên, An Giang",,An Giang,Multibrand,Bảo Việt
3152,3233,Công ty TNHH Trường Vinh Hino,Công ty TNHH Trường Vinh Hino,"Đường CMT8, ấp Hương Giang, P. Long Hương, TX Bà Rịa, BR-VT",,Bà Rịa-Vũng Tàu,Multibrand,Bảo Việt
3153,3234,Công ty TNHH DVTM Hùng Phượng,Công ty TNHH DVTM Hùng Phượng,"Thôn Riễu, xã Dĩnh Trì, Tp. Bắc Giang, tỉnh Bắc Giang",,Bắc Giang,Multibrand,Bảo Việt
3154,3235,Thaco Bắc Giang,Thaco Bắc Giang,Khu D3 cụmcôngnghiệp Dĩnh Kế- xã Dĩnh Kế- TP Bắc Giang- Bắc Giang,,Bắc Giang,Thaco,Bảo Việt
3155,3236,Công ty TNHH Thương Mại Nam Mai,Công ty TNHH Thương Mại Nam Mai,"""Dĩnh Kế - TP Bắc Giang - Bắc Giang",,Bắc Giang,Multibrand,Bảo Việt
3156,3237,DNTN Hoàng Huynh,DNTN Hoàng Huynh,Thôn Nam Đội Thân - Xã Nông Thượng - TX Bắc Kạn - Tỉnh Bắc Kạn,,Bắc Kạn,Multibrand,Bảo Việt
3157,3238,Chevrolet Dương Tuấn (GM Dương Tuấn),GM Dương Tuấn,"Đường Lê Thái Tổ, P. Võ Cường, Tp. Bắc Ninh",,Bắc Ninh,Chevrolet,Bảo Việt
3158,3239,Thaco Bắc Ninh,Thaco Bắc Ninh,"""Lô số 4 và số 15, Cụm CN Võ Cường, P. Võ Cường, TP. Bắc Ninh, Tỉnh Bắc Ninh",,Bắc Ninh,Thaco,Bảo Việt
3159,3240,Công ty TNHH Toyota Bắc Ninh,Toyota Bắc Ninh,"Lô A, Đường Lê Thái Tổ, P. Võ Cường, Tp. Bắc Ninh, tỉnh BN",2413686666,Bắc Ninh,Toyota,Bảo Việt
3160,3241,DNTN Ô tô Ngọc Thành,DNTN Ô tô Ngọc Thành,"""QL60 - Số 192 - Ấp 1 - Xã Sơn Đông - TP Bến Tre - Tỉnh Bến Tre",,Bến Tre,Multibrand,Bảo Việt
3161,3242,Đại lý Đà Nẵng Ford Bình Định,Ford Bình Định,"73 Đường Tây Sơn, Tp. Quy Nhơn, Bình Định",,Bình Định,Ford,Bảo Việt
3162,3243,DNTN Ô tô Hải Thành,DNTN Ô tô Hải Thành,"Đường Tây Sơn, P. Nhơn Phú, Quy Nhơn, Bình Định",,Bình Định,Multibrand,Bảo Việt
3163,3244,Công ty TNHH Việt Nhật J.P,Công ty TNHH Việt Nhật J.P,"16 Lê Hồng Phong, Quy Nhơn, Bình Định",,Bình Định,Multibrand,Bảo Việt
3164,3245,Kia Bình Định,Kia Bình Định,"236A Đường Tây Sơn, Phường Nguyễn Văn Cừ, Thành phố Quy Nhơn, Tỉnh Bình Định",,Bình Định,Kia,Bảo Việt
3165,3246,Mazda Quy Nhơn,Mazda Quy Nhơn,"52 Tăng Bạt Hổ, Tp. Quy Nhơn, tỉnh Bình Định",,Bình Định,Mazda,Bảo Việt
3166,3247,Công ty Cổ phần Ô tô Trường Hải – Chi nhánh Bình Định,Công ty Cổ phần Ô tô Trường Hải – Chi nhánh Bình Định,"Quốc lộ 1D, Tổ 1, KV 8, Phường Nhơn Phú, Quy Nhơn, Bình Định",,Bình Định,Multibrand,Bảo Việt
3167,3248,XN Toyota Đà Nẵng (TDN) - CN Quy Nhơn,TDN) - CN Quy Nhơn,"278A Nguyễn Thị Định, P.Nguyễn Văn Cừ, Tp. Quy Nhơn, Bình Định",,Bình Định,Toyota,Bảo Việt
3168,3249,DNTN Hải Thành,DNTN Hải Thành,"Đường Tây Sơn - Tổ2 - Khu vực 8 - Phường Nhơn Phú - TP Quy Nhơn
 - Bình Định",,Bình Định,Multibrand,Bảo Việt
3169,3250,Công Ty TNHH Sang Trang,Công Ty TNHH Sang Trang,QL1D- Tổ 1- KV8- Phường Nhơn Phú- TP. Quy Nhơn- Bình Định,,Bình Định,Multibrand,Bảo Việt
3170,3251,Chevrolet Nam Thái (GM Nam Thái),GM Nam Thái,"T6/27 QL13, Huyện Thuận An, Bình Dương",,Bình Dương,Chevrolet,Bảo Việt
3171,3252,Chrysler Bình Dương - Đại lý Chrysler ủy quyền chính thức,Chrysler Bình Dương - Đại lý Chrysler ủy quyền chính thức,"90/10 Đại lộ Bình Dương, KP Đông Nhì, TT. Lái Thiêu, H. Thuận An, Bình Dương",,Bình Dương,Multibrand,Bảo Việt
3172,3253,Công ty Cổ phần dịch vụ ô tô Thành phố mới Bình Dương,Công ty Cổ phần dịch vụ ô tô Thành phố mới Bình Dương,"Lô C13, Nguyễn Huệ, KLH, P.Phú Hòa, Tp.Thủ Dầu Một, Bình Dương",,Bình Dương,Multibrand,Bảo Việt
3173,3254,Hyundai Bình Dương,Hyundai Bình Dương,"48A Đại lộ Bình Dương, TX Thủ Dầu Một, Bình Dương",,Bình Dương,Hyundai,Bảo Việt
3174,3255,I-mark Salon Lee,I-mark Salon Lee,"Đường 22/12 Hòa Lân, Thuận Giao, Thuận An, Bình Dương",,Bình Dương,Multibrand,Bảo Việt
3175,3256,Isuzu Thuận Phú,Isuzu Thuận Phú,"49/6 Đại lộ Bình Dương, Vĩnh Phú, Thuận An, Bình Dương",,Bình Dương,Isuzu,Bảo Việt
3176,3257,DNTN Sản xuất và Thương mại Phú Cường,DNTN Sản xuất và Thương mại Phú Cường,"1B QL1K, KP Nội Hóa 2, P. Bình An, TX Dĩ An, Bình Dương",,Bình Dương,Multibrand,Bảo Việt
3177,3258,Kia Bình Dương,Kia Bình Dương,"56/9 Đại lộ Bình Dương, Thị xã Thuận An, Bình Dương",,Bình Dương,Kia,Bảo Việt
3178,3259,Luxgen Bình Dương,Luxgen Bình Dương,"7A/12A Đại lộ Bình Dương, KP Bình Đức, P. Bình Hòa, TX Thuận An, Bình Dương",,Bình Dương,Multibrand,Bảo Việt
3179,3260,Mazda Bình Dương,Mazda Bình Dương,"56/9 Đại lộ Bình Dương, Tổ 15 KP. Bình Giao, P. Thuận Giao, TX Thuận An, Bình Dương",,Bình Dương,Mazda,Bảo Việt
3180,3261,Công ty Á Châu,Công ty Á Châu,"25B/10 KP Đông Nhì, P. Lái Thiêu, TX Thuận An, tỉnh Bình Dương",,Bình Dương,Multibrand,Bảo Việt
3181,3262,Công ty TNHH TM Huy Phát,Công ty TNHH TM Huy Phát,"7/31B Đại lộ Bình Dương, Bình Hòa, Thuận An, Bình Dương",,Bình Dương,Multibrand,Bảo Việt
3182,3263,Peugeot Khu vực Bình Dương và Đông Nam Bộ - Showroom Bình Dương,Peugeot Khu vực Bình Dương và Đông Nam Bộ - Showroom Bình Dương,"56/9 ĐLBD, Tổ 15, KP. Bình Giao, P. Thuận Giao, TX. Thuận An, Tỉnh. Bình Dương",,Bình Dương,Peugeot,Bảo Việt
3183,3264,Công ty TNHH Ô tô Á Châu,Công ty TNHH Ô tô Á Châu,"Đông Nhì, Lái Thiêu, Thuận An, Bình Dương",,Bình Dương,Multibrand,Bảo Việt
3184,3265,Công ty CP Dương Gia Phát,Công ty CP Dương Gia Phát,"Ấp Tân Thịnh, xã An Bình, Phú Giáo, Bình Dương",,Bình Dương,Multibrand,Bảo Việt
3185,3266,Công ty Cổ phần ô tô Trường Hải - CN Bình Dương,Công ty Cổ phần ô tô Trường Hải - CN Bình Dương,"Số 40C xa lộ hà nội, Khu Phố Hiệp Thắng, Phường Bình Thắng, Thị xã Dĩ An, Tỉnh Bình Dương",,Bình Dương,Multibrand,Bảo Việt
3186,3267,CN. Lái Thiêu - Cty CP Ô Tô Trường Hải,CN. Lái Thiêu - Cty CP Ô Tô Trường Hải,"3A Khóm Bình Hòa, TT. Lái Thiêu, H. Thuận An, Bình Dương",,Bình Dương,Multibrand,Bảo Việt
3187,3268,Toyota Biên Hòa - CN Bình Dương (TBH-BD),TBH-BD,"Số 7/30C QL13, Ấp Bình Đức, xã Bình Hòa, huyện Thuận An, Bình Dương",,Bình Dương,Toyota,Bảo Việt
3188,3269,Công ty CP Toyota Đông Sài Gòn - CN Bình Dương,Toyota Đông Sài Gòn - CN Bình Dương,"Lô C3 đường Hùng Vương, P. Phú Hòa, Tp. Thủ Dầu Một, Bình Dương",,Bình Dương,Toyota,Bảo Việt
3189,3270,Công Ty TNHH 1 Thành viên Ô Tô Tam Bình,Công Ty TNHH 1 Thành viên Ô Tô Tam Bình,Số 132A - Ấp Đông Ba -Bình Hoà - Thuận An - Bình Dương,,Bình Dương,Multibrand,Bảo Việt
3190,3271,Công Ty CP Trang My,Công Ty CP Trang My,44C-Xa Lộ Hà Nội - Huyện Dĩ An - Tỉnh Bình Dương,,Bình Dương,Multibrand,Bảo Việt
3191,3272,Công ty TNHH một thành viên SXDVTM Việt Trung Hoa,Công ty TNHH một thành viên SXDVTM Việt Trung Hoa,"439 Đại lộ Bình Dương, KP Nguyễn Trãi, Lái Thiêu, Thuận An, Bình Dương",,Bình Dương,Multibrand,Bảo Việt
3192,3273,Kia Bình Phước,Kia Bình Phước,"648 Phú Riềng Đỏ, P. Tân Xuân, TX Đồng Xoài, Bình Phước",,Bình Phước,Kia,Bảo Việt
3193,3274,Mazda Bình Phước,Mazda Bình Phước,"648 Phú Riềng Đỏ, P. Tân Xuân, TX Đồng Xoài, Bình Phước",,Bình Phước,Mazda,Bảo Việt
3194,3275,Kia Phan Thiết,Kia Phan Thiết,"QL1A, thôn Thắng Lợi, xã Hàm Thắng, huyện Hàm Thuận Bắc, tỉnh Bình Thuận",,Bình Thuận,Kia,Bảo Việt
3195,3276,Công ty Minh Phát,Công ty Minh Phát,"Số1 LôA,Khudâncư BếnLội,HàmThắng,HàmThuậnBắc,BìnhThuận",,Bình Thuận,Multibrand,Bảo Việt
3196,3277,Công ty TNHH MTV Ngọc Điệp,Công ty TNHH MTV Ngọc Điệp,108 Trần Quý Cáp - TP Phan Thiết - Tỉnh Bình Thuận,,Bình Thuận,Multibrand,Bảo Việt
3197,3278,Công ty TNHH Hino Tây Nguyên,Công ty TNHH Hino Tây Nguyên,"90 Nguyễn Chí Thanh, Tp. Buôn Ma Thuột",,Đắk Lắk,Multibrand,Bảo Việt
3198,3279,Công ty TNHH TM Đại Tín Phát,Công ty TNHH TM Đại Tín Phát,"Số 333 Lý Thường Kiệt, Khóm 7, P6, Tp. Cà Mau",,Cà Mau,Multibrand,Bảo Việt
3199,3280,Kia Tiến Phát,Kia Tiến Phát,Lô số 01- đường Vành Đai 2 - phường 9 - Tp.Cà Mau - Tỉnh Cà Mau,,Cà Mau,Kia,Bảo Việt
3200,3281,Trung tâm Ô tô Ngọc Anh,Trung tâm Ô tô Ngọc Anh,"111 Lý Thường Kiệt, P6, Cà Mau",,Cà Mau,Multibrand,Bảo Việt
3201,3282,DNTN Nguyễn Thanh Thảo,DNTN Nguyễn Thanh Thảo,"362 Nguyễn Trãi, khóm 4, phường 9, TP.Cà Mau, tỉnh Cà Mau",,Cà Mau,Multibrand,Bảo Việt
3202,3283,Công ty Cổ phần Ô tô Sài Gòn Cửu Long,Công ty Cổ phần Ô tô Sài Gòn Cửu Long,"274 đường 30/4 P. Hưng Lợi, Q. Ninh Kiều, Cần Thơ",,Cần Thơ,Multibrand,Bảo Việt
3203,3284,Chi nhánh Đại lý Sài Gòn Ford Cần Thơ,Ford Cần Thơ,"41A Đường 3/2, Xuân Khánh, Cần Thơ","0""0907751707",Cần Thơ,Ford,Bảo Việt
3204,3285,Hyundai Tây Đô,Hyundai Tây Đô,"91 CMT8, P. An Thới, Q. Bình Thủy, Tp. Cần Thơ",,Cần Thơ,Hyundai,Bảo Việt
3205,3286,I-mark Salon Gentraco,I-mark Salon Gentraco,"Lô 3-16 Lê Hồng Phong, P. Bình Thủy, Q. Bình Thủy, Cần Thơ",,Cần Thơ,Multibrand,Bảo Việt
3206,3287,Kia Cần Thơ,Kia Cần Thơ,"340 Cách Mạng Tháng Tám, Phường Bùi Hữu Nghĩa, Quận Bình Thủy, TP Cần Thơ",,Cần Thơ,Kia,Bảo Việt
3207,3288,Mazda Cần Thơ,Mazda Cần Thơ,"340 CMT8, P. Bùi Hữu Nghĩa, Q. Bình Thủy, Tp. Cần Thơ",,Cần Thơ,Mazda,Bảo Việt
3208,3289,Công ty Ô tô Sài Gòn,Công ty Ô tô Sài Gòn,"70 Đường 3/2, P. Hưng Lợi, Q. Ninh Kiều, Cần Thơ",,Cần Thơ,Multibrand,Bảo Việt
3209,3290,Công ty TNHH VEAM MOTOR CT,Công ty TNHH VEAM MOTOR CT,"QL1, KV1, P. Ba Láng, Q. Cái Răng, Cần Thơ",,Cần Thơ,Multibrand,Bảo Việt
3210,3291,Mercedes - Benz Haxaco Cần Thơ,Mercedes - Benz Haxaco Cần Thơ,"102 CMT8, Cái Khế, Ninh Kiều, Tp. Cần Thơ",,Cần Thơ,Mercedes,Bảo Việt
3211,3292,Công ty TNHH MTV Cơ khí Ô tô Cần Thơ,Công ty TNHH MTV Cơ khí Ô tô Cần Thơ,"274 Đường 30/4, P. Hưng Lợi, Q. Ninh Kiều, Tp. Cần Thơ",,Cần Thơ,Multibrand,Bảo Việt
3212,3293,Nissan Cần Thơ,Nissan Cần Thơ,"141 Đường 30/4, P. Hưng Lợi, Q. Ninh Kiều, Cần Thơ","0""0909643839",Cần Thơ,Nissan,Bảo Việt
3213,3294,CN Tây Đô-Công Ty CP Ô Tô Trường Hải,CN Tây Đô-Công Ty CP Ô Tô Trường Hải,"Đường Quang Trung,KDC Hưng Phú 1-P.Hưng Phú-Q.Cái Răng,TP. Cần Thơ",,Cần Thơ,Multibrand,Bảo Việt
3214,3295,Công ty TNHH Toyota Cần Thơ (TCTC),TCTC,"Lô 20 Đường Quang Trung, P. Phú Thứ, Q. Cái Răng, Tp. Cần Thơ",,Cần Thơ,Toyota,Bảo Việt
3215,3296,Công ty TNHH Toyota Ninh Kiều,Toyota Ninh Kiều,"57 (59A) CMT8, P. An Hòa, Quận Ninh Kiều, Tp. Cần Thơ",2923756666,Cần Thơ,Toyota,Bảo Việt
3216,3297,Công ty TNHH Sài Gòn ô tô,Công ty TNHH Sài Gòn ô tô,"Ấp Tân Thạch Đông, X Tân Phú Thạch, Châu Thành, Cần Thơ",,Cần Thơ,Multibrand,Bảo Việt
3217,3298,Thaco Xuân Hòa Cao Bằng,Thaco Xuân Hòa Cao Bằng,Số 45 - Phố Kim Đồng - Hợp Giang - T.Cao Bằng,,Cao Bằng,Thaco,Bảo Việt
3218,3299,Công ty CP ĐTPT Hùng Vương,Công ty CP ĐTPT Hùng Vương,Số 44 - Hoàng Đình Giong - P. Hợp Giang - TX Cao Bằng,,Cao Bằng,Multibrand,Bảo Việt
3219,3300,CN.Đà Lạt- CtyCP ÔTôTrườngHảiT. ĐồngNai,CN.Đà Lạt- CtyCP ÔTôTrườngHảiT. ĐồngNai,"Số 2 Bis Đường 3/4, Phường 3, TP. Đà Lạt",,Lâm Đồng,Multibrand,Bảo Việt
3220,3301,Chevrolet Đà Nẵng (GM Đà Nẵng),GM Đà Nẵng,"A2-2, ngã tư Tuyên Sơn, đường 2/9, quận Hải Châu, tp. Đà Nẵng",,Đà Nẵng,Chevrolet,Bảo Việt
3221,3302,Đại lý Ford Đà Nẵng,Ford Đà Nẵng,"56 Đường Điện Biên Phủ, Đà Nẵng",,Đà Nẵng,Ford,Bảo Việt
3222,3303,Công ty TNHH MTV Thái Thịnh Nam Miền Trung,Công ty TNHH MTV Thái Thịnh Nam Miền Trung,"QL1A xã Hòa Phước, huyện Hòa Vang, Tp. Đà Nẵng",,Đà Nẵng,Multibrand,Bảo Việt
3223,3304,Honda Ôtô Đà Nẵng,Honda Ôtô Đà Nẵng,"Lô A11 Đường 2/9 Q. Hải Châu, Tp. Đà Nẵng",,Đà Nẵng,Honda,Bảo Việt
3224,3305,Hyundai Cẩm Lệ,Hyundai Cẩm Lệ,"158 CMT8, Tp. Đà Nẵng",,Đà Nẵng,Hyundai,Bảo Việt
3225,3306,Hyundai Sông Hàn,Hyundai Sông Hàn,"86 Duy Tân, Q. Hải Châu, Đà Nẵng",,Đà Nẵng,Hyundai,Bảo Việt
3226,3307,I-mark Salon Gelimex,I-mark Salon Gelimex,"372 Ngũ Hành Sơn, Tp. Đà Nẵng",,Đà Nẵng,Multibrand,Bảo Việt
3227,3308,Kia Đà Nẵng,Kia Đà Nẵng,"356 Điện Biên Phủ, Thanh Khê Đông, Quận Thanh Khê, Đà Nẵng",,Đà Nẵng,Kia,Bảo Việt
3228,3309,Mazda Đà Nẵng,Mazda Đà Nẵng,"405 Tôn Đức Thắng, Hòa Minh, Liên Chiểu, Đà Nẵng",,Đà Nẵng,Mazda,Bảo Việt
3229,3310,Mercedes - Benz An Du Đà Nẵng,Mercedes - Benz An Du Đà Nẵng,"113 Nguyễn Hữu Thọ, Hải Châu, Đà Nẵng",,Đà Nẵng,Mercedes,Bảo Việt
3230,3311,TTÔtô DaescoCôngty Cổ phầnTBPT Đà Nẵng,TTÔtô DaescoCôngty Cổ phầnTBPT Đà Nẵng,"51 Phan Đăng Lưu, Tp. Đà Nẵng",,Đà Nẵng,Multibrand,Bảo Việt
