,Unnamed: 0,Company,Name Gara,Address,Phone,Province,Brand,Liên kết
1050,1119,Gara Minh Nguyệt,Gara Minh Nguyệt,"– Địa chỉ xưởng 1: 241 Ung Văn Khiêm, Phường 25, Quận Bình Thạnh, TP.Hồ Chí Minh
– Địa chỉ xưởng 2: 722 Điện Biên Phủ, Phường 22, Quận Bình Thạnh, TP.Hồ Chí Minh",,Tp Hcm,Multibrand,PVI
1051,1120,Gara Tân Thế giới ô tô,Gara Tân Thế giới ô tô,"783 Kinh Dương Vương, Phường An Lạc, Quận Bình Tân, TP.Hồ Chí Minh",,Tp Hcm,Multibrand,PVI
1052,1121,Gara Hoàng Phi Hải,Gara Hoàng Phi Hải,"20G/1 đường Ht 17, KP2, P.Hiệp Thành, Quận 12, TP.HCM",,Tp Hcm,Multibrand,PVI
1053,1122,Gara Thuận Tiến Phát,Gara Thuận Tiến Phát,"104 Tân Sơn, Phường 15, Quận Tân Bình, TP.HCM",,Tp Hcm,Multibrand,PVI
1054,1123,Gara 79,Gara 79,"Khu C30 lô B5 Thành Thái, phường 14, Quận 10, TP.HCM",,Tp Hcm,Multibrand,PVI
1055,1124,Gara Thiên Hải,Gara Thiên Hải,"93 Phạm Văn Chiêu, Phường 14, Quận Gò Vấp, TP.HCM",,Tp Hcm,Multibrand,PVI
1056,1125,Gara Minh Đạt,Gara Minh Đạt,"204/24 Quốc lộ 13, Phường 26, Quận Bình Thạnh, TP.HCM",,Tp Hcm,Multibrand,PVI
1057,1126,Mitsubishi Phương Nguyên,Mitsubishi Phương Nguyên,"63 Bis Võ Văn Kiệt, phường An Lạc, Q. Bình Tân, TP. HCM",,Tp Hcm,Mitsubishi,PVI
1058,1127,Suzuki Đại Việt,Suzuki Đại Việt,"438 Nguyễn Duy Trinh, P Bình Trưng Đông, Quận
2, TP.HCM",,Tp Hcm,Suzuki,PVI
1059,1128,Toyota An Thành Fukushima,Toyota An Thành Fukushima,"C4/4B Khu phố 3, Đường Bùi Thanh Khiết, TT. Tân Túc, huyện Bình Chánh, TP.HCM",,Tp Hcm,Toyota,PVI
1060,1129,Honda Kim Thanh,Honda Kim Thanh,"Số 6, Đường 3/2, P15, Q.11, TP.HCM",08 38662222,Tp Hcm,Honda,PVI
1061,1130,City Ford,City Ford,"218 Quốc lộ 13, Phường Hiệp Bình Chánh, Quận Thủ Đức, TP.HCM",028 3726 3626,Tp Hcm,Ford,PVI
1062,1131,TOYOTA Tân Cảng,TOYOTA Tân Cảng,"220B Bis Đường Điện Biên Phủ, Phường 22, Quận Bình Thạnh, TP.HCM",,Tp Hcm,Toyota,PVI
1063,1132,Nissan Miền Tây,Nissan Miền Tây,"54 Kinh Dương Vương, Phường 13, Quận 6, TP Hồ Chí Minh",,Tp Hcm,Nissan,PVI
1064,1133,TOYOTA Hùng Vương,TOYOTA Hùng Vương,"26 Kinh Dương Vương, Phường 13, Quận 6, TP HCM",,Tp Hcm,Toyota,PVI
1065,1134,TOYOTA Lý Thường Kiệt- CN Tân Phú,TOYOTA Lý Thường Kiệt- CN Tân Phú,188 Lê Trọng Tấn – P.Tây Thạnh – Q.Tân Phú – TP.HCM,,Tp Hcm,Toyota,PVI
1066,1135,TOYOTA Lý Thường Kiệt,TOYOTA Lý Thường Kiệt,"151A Lý Thường Kiệt, P6, Q.Tân Bình, Tp.HCM",0(08) 39713838,Tp Hcm,Toyota,PVI
1067,1136,Tây Ford,Tây Ford,"530 Kinh Dương Vương, P.An Lạc, Q.Bình Tân, TP.HCM",,Tp Hcm,Ford,PVI
1068,1137,Hyundai Phú Mỹ,Hyundai Phú Mỹ,"Lô D3, đường D1, KCN Cát Lái, Q2, TP.HCM",,Tp Hcm,Hyundai,PVI
1069,1138,Bến Thành Ford,Bến Thành Ford,"831 Trường Chinh, phường Tây Thạnh, Quận Tân Phú, TP.Hồ Chí Minh",2838157979,Tp Hcm,Ford,PVI
1070,1139,Honda Quận 7,Honda Quận 7,"Nhà A, Khu chức năng số 4, Trung tâm Thương mại ven sông Tân Phong, đường Nguyễn Văn Linh, phường Tân Phong, quận 7, TP.HCM",2839168888,Tp Hcm,Honda,PVI
1071,1140,Honda Cộng Hòa,Honda Cộng Hòa,"18 Cộng Hòa, P.4, Q. Tân Bình, TP.HCM",,Tp Hcm,Honda,PVI
1072,1141,Subaru Quận 12,Subaru Quận 12,"65/1A Lê Thị Riêng, KP2, Phường Thới An, Quận 12, TP.HCM",,Tp Hcm,Subaru,PVI
1073,1142,Subaru Minh Thanh – Phú Mỹ,Subaru Minh Thanh – Phú Mỹ,"Lô D3 Đường D1, KCN Cát Lái, Phường Thạnh Mỹ Lợi, Quận 2, TP.HCM",,Tp Hcm,Subaru,PVI
1074,1143,Gara Thanh Hậu,Gara Thanh Hậu,"520A Hà Huy Giáp, P.Thạnh Lộc, Q.12, TP.HCM",,Tp Hcm,Multibrand,PVI
1075,1144,Gara xe tải Ô tô Miền Nam,Gara xe tải Ô tô Miền Nam,"68 Quốc lộ 1A, P.An Phú Đông, Quận 12, TP.Hồ Chí Minh",,Tp Hcm,Multibrand,PVI
1076,1145,Gara Tiến Phát,Gara Tiến Phát,"Số 40 đường số 40, Phường Thảo Điền, quận 2, TP.Hồ Chí Minh",903385977,Tp Hcm,Multibrand,PVI
1077,1146,Gara Easy Car,Gara Easy Car,"824 Quốc lộ 13, Phường Hiệp Bình Phước, Quận
Thủ Đức, TP.HCM",,Tp Hcm,Multibrand,PVI
1078,1147,TOYOTA An Sương,TOYOTA An Sương,"382 QL.22, P.Trung Mỹ Tây, Q.12, Tp.HCM",,Tp Hcm,Toyota,PVI
1079,1148,Toyota An Sương – CN Trường Chinh,Toyota An Sương – CN Trường Chinh,"113 Trường Chinh, P.TTN, Q.12, TP HCM",,Tp Hcm,Toyota,PVI
1080,1149,Honda Phát Tiến,Honda Phát Tiến,"136D đường Mai Chí Thọ, phường An Phú, Quận 2, TP.HCM",2836362121,Tp Hcm,Honda,PVI
1081,1150,TOYOTA Bến Thành,TOYOTA Bến Thành,"262 Trần Hưng Đạo, Quận 1, TP.HCM",,Tp Hcm,Toyota,PVI
1082,1151,Toyota Bến Thành – CN Chương Dương,Toyota Bến Thành – CN Chương Dương,"326 Võ Văn Kiệt, phường Cô Giang, Quận 1, TP.HCM",,Tp Hcm,Toyota,PVI
1083,1152,Gia Định Ford,Gia Định Ford,"900 Quốc lộ 1A, Phường Thạnh Xuân, Quận 12, TP.HCM",,Tp Hcm,Ford,PVI
1084,1153,Gara Hưng Thịnh,Gara Hưng Thịnh,"Số 369 Cây Trâm, phường 8, Quận Gò Vấp, TP.HCM",,Tp Hcm,Multibrand,PVI
1085,1154,Gara Tuấn Sen,Gara Tuấn Sen,"43/6 Đường 17, KP5, phường Linh Trung, quận Thủ Đức, TP.HCM",,Tp Hcm,Multibrand,PVI
1086,1155,CÔNG TY TNHH TOYOTA HÀ ĐÔNG,TOYOTA HÀ ĐÔNG,"977-979 Quang Trung kéo dài, Yên Nghĩa, Hà
 Đông, Hà Nội",2433535858,Hà Nội,Toyota,Bảo Minh
1087,1156,"CÔNG TY CỔ PHẦN TOYOTA THÁI HOÀ TỪ
 LIÊM","TOYOTA THÁI HOÀ TỪ
 LIÊM","Số 02 Ngọc Trục, P. Mộ Lao, Q. Nam Từ Liêm, Hà
 Nội",243354888,Hà Nội,Toyota,Bảo Minh
1088,1157,"CÔNG TY CỔ PHẦN TOYOTA IDMC HOÀI
 ĐỨC","TOYOTA IDMC HOÀI
 ĐỨC","Thị trấn trạm Trôi, Hoài Đức, Hà Nội",2433866633,Hà Nội,Toyota,Bảo Minh
1089,1158,CÔNG TY CỔ PHẦN TOYOTA HOÀ BÌNH,TOYOTA HOÀ BÌNH,"Phường Trung Minh,Tp Hoà Bình",218388255,Hà Nội,Toyota,Bảo Minh
1090,1159,CÔNG TY TNHH TOYOTA LONG BIÊN,TOYOTA LONG BIÊN,"Số 7,9 Nguyễn Văn Linh , Phường Gia Thuy ,
 Quận Long Biên, TP.Hà Nội",2403636363,Hà Nội,Toyota,Bảo Minh
1091,1160,XÍ NGHIỆP TOYOTA HOÀN KIẾM,TOYOTA HOÀN KIẾM,"Số 7 Đặng Thái Thân, Hoàn Kiếm, TP Hà Nội",248250914,Hà Nội,Toyota,Bảo Minh
1092,1161,CÔNG TY TNHH TOYOTA THANH XUÂN,TOYOTA THANH XUÂN,"Số 315 đường Trường Chinh, Phường Khương
 Mai, Q Thanh Xuân, TP Hà Nội",2435656666,Hà Nội,Toyota,Bảo Minh
1093,1162,"CÔNG TY TNHH MỘT THÀNH VIÊN TOYOTA
 MỸ ĐÌNH .","TOYOTA
 MỸ ĐÌNH .","15 Phạm Hùng , P.Mỹ Đình 2 , Nam Từ Liêm , Hà
 Nội",2437686666,Hà Nội,Toyota,Bảo Minh
1094,1163,CÔNG TY CỔ PHẦN TOYOTA THĂNG LONG,TOYOTA THĂNG LONG,"Số 31 6 Cầu giấy , P Dịch Vọng - TP.Hà Nội",2438338888,Hà Nội,Toyota,Bảo Minh
1095,1164,CÔNG TY CP ĐT&TM HOÀ BÌNH MINH,CÔNG TY CP ĐT&TM HOÀ BÌNH MINH,"Tổ 17, P. Yên Nghĩa, Q.Hà Đông, HN",2433535399,Hà Nội,Multibrand,Bảo Minh
1096,1165,"CÔNG TY TNHH Ô TÔ THÀNH CÔNG ĐÔNG
 ĐÔ","CÔNG TY TNHH Ô TÔ THÀNH CÔNG ĐÔNG
 ĐÔ","Tổ 25, TT Đông Anh, Huyện Đông Anh, TP Hà
 Nội",2432045888,Hà Nội,Multibrand,Bảo Minh
1097,1166,CÔNG TY TNHH MOTOR N.A VIỆT NAM,CÔNG TY TNHH MOTOR N.A VIỆT NAM,"Số 197 Ghi Tàm, Yên Phụ, Tây Hồ, TP.Hà Nội",247672329,Hà Nội,Multibrand,Bảo Minh
1098,1167,CÔNG TY CP ĐẦU TƯ KD TỔNG HỢP D&C,CÔNG TY CP ĐẦU TƯ KD TỔNG HỢP D&C,Số 2 Lê Đức Thọ Mai Dịch Cầu giấy - TP.Hà Nội,24645566,Hà Nội,Multibrand,Bảo Minh
1099,1168,"CÔNG TY CỔ PHẦN PHỤ TÙNG VÀ TƯ VẤN
 Ô TÔ","CÔNG TY CỔ PHẦN PHỤ TÙNG VÀ TƯ VẤN
 Ô TÔ",Số 434 Trần khát chân HBT TP.Hà Nội,2439727272,Hà Nội,Multibrand,Bảo Minh
1100,1169,"CÔNG TY TNHH MTV KD & DV Ô TÔ LONG
 BIÊN","CÔNG TY TNHH MTV KD & DV Ô TÔ LONG
 BIÊN","Số 3Nguyễn Văn Linh P Gia Thụy Long Biên,
 TP.Hà Nội",2435763333,Hà Nội,Multibrand,Bảo Minh
1101,1170,CÔNG TY TNHH MTV KD & DV Ô TÔ HÀ NỘI,CÔNG TY TNHH MTV KD & DV Ô TÔ HÀ NỘI,"311-313 Trường Chinh, Phường Khương Mai,",976804259,Hà Nội,Multibrand,Bảo Minh
1102,1172,CÔNG TY TNHH MTV KD & DV Ô TÔ THANH XUÂN,CÔNG TY TNHH MTV KD & DV Ô TÔ THANH XUÂN,"Số 88 Nguyễn Xiển, Hạ Đình, Thanh Xuân, Hà
 Nội",,Hà Nội,Multibrand,Bảo Minh
1103,1173,"CÔNG TY CP TRUYỀN THÔNG VÀ DỮ LIỆU
 THANH TOÁN AN DU","CÔNG TY CP TRUYỀN THÔNG VÀ DỮ LIỆU
 THANH TOÁN AN DU","11 Phạm Hùng, Mỹ Đình, Từ Liêm, Hà Nội",978738510,Hà Nội,Multibrand,Bảo Minh
1104,1174,"CN CÔNG TY CP DỊCH VỤ Ô TÔ HÀNG XANH
 TẠI HÀ NỘI","CN CÔNG TY CP DỊCH VỤ Ô TÔ HÀNG XANH
 TẠI HÀ NỘI","Số 46 Láng Hạ, Phường Láng Hạ, Quận Đống Đa,
 TP Hà Nội",2437644646,Hà Nội,Multibrand,Bảo Minh
1105,1175,CÔNG TY TNHH ĐT TM& DV VẬN TẢI HỒNG PHÁT,CÔNG TY TNHH ĐT TM& DV VẬN TẢI HỒNG PHÁT,"Tổ 9,P.Phú Lãm, Q.Hà Đông, Hà Nội",2432058889,Hà Nội,Multibrand,Bảo Minh
1106,1176,"KIA GIẢI PHÓNG - CÔNG TY CỔ PHẦN XÂY
 DỰNG VÀ VẬT TƯ TH","KIA GIẢI PHÓNG - CÔNG TY CỔ PHẦN XÂY
 DỰNG VÀ VẬT TƯ TH","Km10, Đường Giải Phóng, Xã Tứ Hiệp, Huyện
 Thanh Trì, Hà Nội",965958039,Hà Nội,Kia,Bảo Minh
1107,1177,"SHOWROOM MAZDA PHẠM VĂN ĐỒNG -
 CHI NHÁNH BẮC TỪ LIÊM","MAZDA PHẠM VĂN ĐỒNG -
 CHI NHÁNH BẮC TỪ LIÊM","Lô CC2, Khu đô thị Thành phố Giao lưu, Bắc Từ
 Liêm, Hà Nội 10000",938383643,Hà Nội,Mazda,Bảo Minh
1108,1178,"CÔNG TY TNHH DỊCH VỤ TỔNG HỢP PHÚC
 THÁI","CÔNG TY TNHH DỊCH VỤ TỔNG HỢP PHÚC
 THÁI","LôB2-29, Khu đất NO4 , Đường Việt Hưng, Quận
 Long Biên TP.Hà Nội",968174555,Hà Nội,Multibrand,Bảo Minh
1109,1179,CÔNG TY CP GREENPATH HÀ NỘI,CÔNG TY CP GREENPATH HÀ NỘI,"Số 3 Lê Quang Đạo , Mễ Trì Từ Liêm, TP.Hà Nội",2437878177,Hà Nội,Multibrand,Bảo Minh
1110,1180,"CÔNG TY CỔ PHẦN ĐẦU TƯ DV&TM
 QUANG MINH","CÔNG TY CỔ PHẦN ĐẦU TƯ DV&TM
 QUANG MINH","Phú Diễn, Quận Bắc Từ Liêm, TP Hà Nội",2433703333,Hà Nội,Multibrand,Bảo Minh
1111,1181,"CÔNG TY CP QUẢN LÝ ĐẦU TƯ VÀ PHÁT
 TRIỂN QUANG MINH","CÔNG TY CP QUẢN LÝ ĐẦU TƯ VÀ PHÁT
 TRIỂN QUANG MINH","Mễ Trì Hạ, P Mễ Trì, Quận Nam Từ Liêm, TP Hà
 Nội",2433703333,Hà Nội,Multibrand,Bảo Minh
1112,1182,"CÔNG TY CỔ PHẦN TƯ VẤN VÀ DỊCH VỤ
 MQA VIỆT NAM","CÔNG TY CỔ PHẦN TƯ VẤN VÀ DỊCH VỤ
 MQA VIỆT NAM","Ngõ 795 Quang Trung, Phú La, Quận Hà Đông,
 TP Hà Nội",904547888,Hà Nội,Multibrand,Bảo Minh
1113,1183,"CÔNG TY TNHH DỊCH VỤ KỸ THUẬT TỔNG
 HỢP NGA TÙNG","CÔNG TY TNHH DỊCH VỤ KỸ THUẬT TỔNG
 HỢP NGA TÙNG","Số 8, Ngõ 1, Ngách 1/34 Phan Đình Giót,
 Phương Liệt, Thanh Xuân",983763393,Hà Nội,Multibrand,Bảo Minh
1114,1184,"CTY CỔ PHẦN ĐẦU TƯ - THƯƠNG MẠI
 QUANG ĐỨC","CTY CỔ PHẦN ĐẦU TƯ - THƯƠNG MẠI
 QUANG ĐỨC","1075 Giải Phóng, Giáp Bát, Hoàng Mai, Hà Nội,
 Vietnam",2436421626,Hà Nội,Multibrand,Bảo Minh
1115,1185,CÔNG TY TNHH KHANG MINH,CÔNG TY TNHH KHANG MINH,"Tổ 4, TT Đông Anh, Huyện Đông Anh, TP Hà Nội",2438839166,Hà Nội,Multibrand,Bảo Minh
1116,1186,CÔNG TY TNHH Ô TÔ ĐỨC TÙNG,CÔNG TY TNHH Ô TÔ ĐỨC TÙNG,Số 2 Lãng Yên Hai Bà Trưng - TP.Hà Nội,0:024222405618,Hà Nội,Multibrand,Bảo Minh
1117,1187,CÔNG TY TNHH THIÊN BẢO ANH,CÔNG TY TNHH THIÊN BẢO ANH,"131 Thái Thịnh, Đống Đa, Hà Nội",2438560805,Hà Nội,Multibrand,Bảo Minh
1118,1188,CÔNG TY CỔ PHẦN ĐẦU TƯ 981,CÔNG TY CỔ PHẦN ĐẦU TƯ 981,"231B Nguyễn Trãi, Thượng Đình, Thanh Xuân,
 Hà Nội",983992909,Hà Nội,Multibrand,Bảo Minh
1119,1189,"CÔNG TY CP PHÁT TRIỂN CÔNG NGHỆ Ô TÔ
 I.TECH","CÔNG TY CP PHÁT TRIỂN CÔNG NGHỆ Ô TÔ
 I.TECH","89 Trần Thái Tông, Cầu Giấy, Hà Nội",967882806,Hà Nội,Multibrand,Bảo Minh
1120,1190,"CÔNG TY TNHH DỊCH VỤ THƯƠNG MẠI Ô
 TÔ THANH PHÚC","CÔNG TY TNHH DỊCH VỤ THƯƠNG MẠI Ô
 TÔ THANH PHÚC","838 Đường Bạch Đằng, P Thanh Lương, Q Hai
 Bà Trưng, Tp Hà Nội",24062932532,Hà Nội,Multibrand,Bảo Minh
1121,1191,ĐẠI LÝ Ô TÔ VINFAST ĐẠI VIỆT,VINFAST ĐẠI VIỆT,"1/2A Nguyễn Văn Linh, Gia Thụy, Long Biên, Hà Nội",813888839,Hà Nội,Vinfast,Bảo Minh
1122,1192,ĐẠI LÝ Ô TÔ VINFAST HÀ NỘI,VINFAST HÀ NỘI,"948 đường Quang Trung kéo dài, Phường Yên
 Nghĩa, Quận Hà Đông, Hà Nội",903446588,Hà Nội,Vinfast,Bảo Minh
1123,1193,CÔNG TY CP TM ĐT TRÀNG AN,CÔNG TY CP TM ĐT TRÀNG AN,"568 đường Láng, phường Láng Hạ, Q. Đống Đa,
 Tp Hà Nội",975118789,Hà Nội,Multibrand,Bảo Minh
1124,1194,CÔNG TY CP KIM LIÊN ĐÔNG ĐÔ,CÔNG TY CP KIM LIÊN ĐÔNG ĐÔ,"26 Pham Văn Đồng, P.Xuân Đỉnh, Q. Bắc Từ
 Liêm, Hà Nội",987966662,Hà Nội,Multibrand,Bảo Minh
1125,1195,CÔNG TY TNHH ĐT TM VÀ DV HBT,CÔNG TY TNHH ĐT TM VÀ DV HBT,"Lô B18/D7 Khu ĐTM Cầu giấy, P. Dịch Vọng, Q. Cầu giấy, Tp Hà Nội","0904776112-
 0979577885-
 0989985198",Hà Nội,Multibrand,Bảo Minh
1126,1196,CÔNG TY TNHH TM VÀ DV TRUNG LÂN,CÔNG TY TNHH TM VÀ DV TRUNG LÂN,"Ngõ 3, Tôn Thất Thuyết,Q. Cầu giấy, TP Hà Nội",963880011,Hà Nội,Multibrand,Bảo Minh
1127,1197,CÔNG TY CP TV VÀ ĐT PT Ô TÔ HÀ NỘI,CÔNG TY CP TV VÀ ĐT PT Ô TÔ HÀ NỘI,"KĐT Thanh Hà, Kiến Hưng, Q. Hà Đông, tp Hà
 Nội",978777020,Hà Nội,Multibrand,Bảo Minh
1128,1198,CÔNG TY TNHH DVTM Ô TÔ THANH PHÚC,CÔNG TY TNHH DVTM Ô TÔ THANH PHÚC,"944 Bạch Đằng, P. Thanh Lương, Q. Hai Bà
 Trưng, Tp. Hà Nội",986434243,Hà Nội,Multibrand,Bảo Minh
1129,1199,CÔNG TY CP PT CN Ô TÔ I.TECH,CÔNG TY CP PT CN Ô TÔ I.TECH,"24 Hoàng Quốc Việt, q. Cầu giấy, tp Hà Nội",967882806,Hà Nội,Multibrand,Bảo Minh
1130,1200,CÔNG TY TNHH MTV HYUNDAI AN KHÁNH,HYUNDAI AN KHÁNH,"Km6, Cụm CN An Khánh, Hoài Đức, Hà Nội",965916686,Hà Nội,Hyundai,Bảo Minh
1131,1201,CÔNG TY TNHH DV TM Ô TÔ THĂNG LONG,CÔNG TY TNHH DV TM Ô TÔ THĂNG LONG,"Nguyễn Chánh, q. Cầu Giấy, Hà Nội",933424666,Hà Nội,Multibrand,Bảo Minh
1132,1202,AUTO QUANG MINH,AUTO QUANG MINH,"Số 1, ngõ 32/48/23 Đỗ Đức Dục, Quận Nam Từ
 Liêm, TP Hà Nội",342606999,Hà Nội,Multibrand,Bảo Minh
1133,1203,GREENPATH GARA,GREENPATH GARA,"3 Lê Quang Đạo, Nam Từ Liêm, Hà Nội",979496685,Hà Nội,Multibrand,Bảo Minh
1134,1204,FORD HÀ NỘI,FORD HÀ NỘI,"311-313 Trường Chinh, phường Khương Mai,
 quận Thanh Xuân, TP Hà Nội",904243875,Hà Nội,Ford,Bảo Minh
1135,1205,GARA DŨNG QUÝ,GARA DŨNG QUÝ,"Số 16, Khu B, Tập thể 664, Xã Vĩnh Quỳnh,
 Huyện Thanh Trì, TP Hà Nội",982237299,Hà Nội,Multibrand,Bảo Minh
1136,1206,HYUNDAI AN KHÁNH,HYUNDAI AN KHÁNH,"C24 – ô 01 đô thị mới Geleximco Lê Trọng Tấn,
 Xã La Phù, Huyện Hoài Đức, Hà Nội",965916686,Hà Nội,Hyundai,Bảo Minh
1137,1207,TOYOTA LONG BIÊN,TOYOTA LONG BIÊN,Số 07 - 09 Nguyễn Văn Linh - Long Biên - Hà Nội,2403636363,Hà Nội,Toyota,Bảo Minh
1138,1208,"CÔNG TY TNHH TM VÀ DV Ô TÔ ĐỨC
 CƯỜNG","CÔNG TY TNHH TM VÀ DV Ô TÔ ĐỨC
 CƯỜNG","Phường Châu Sơn, TP Phủ Lý, Hà Nam",982903313,Hà Nam,Multibrand,Bảo Minh
1139,1209,"CÔNG TY TNHH MTV TRƯỜNG HẢI - HÀ
 NAM","CÔNG TY TNHH MTV TRƯỜNG HẢI - HÀ
 NAM","Thôn Đai Cầu, xã Tiên Tân, TP
 Phủ Lý, Hà Nam",2263576888,Hà Nam,Multibrand,Bảo Minh
1140,1210,CÔNG TY CỔ PHẦN TIẾN THÀNH,CÔNG TY CỔ PHẦN TIẾN THÀNH,"Phường Mộ Lao, quận Hà Đông, Hà Nội",2433824465,Hà Nam,Multibrand,Bảo Minh
1141,1211,HỘ KINH DOANH NGUYỄN VĂN TUYỂN,HỘ KINH DOANH NGUYỄN VĂN TUYỂN,"Phường Liêm Chính, TP Phủ Lý, Hà Nam",916706168,Hà Nam,Multibrand,Bảo Minh
1142,1212,CÔNG TY TNHH CƠ KHÍ AN PHÚ THÀNH,CÔNG TY TNHH CƠ KHÍ AN PHÚ THÀNH,"Lê Hồng Phong, Phủ Lý, Hà Nam",975887575,Hà Nam,Multibrand,Bảo Minh
1143,1213,"CÔNG TY TNHH CƠ KHÍ Ô TÔ TRƯỜNG
 THÀNH","CÔNG TY TNHH CƠ KHÍ Ô TÔ TRƯỜNG
 THÀNH","Xã Tiên Tân, TP Phủ Lý, Hà Nam",2263866726,Hà Nam,Multibrand,Bảo Minh
1144,1214,CÔNG TY TNHH TM VÀ DV Ô TÔ VINAK,CÔNG TY TNHH TM VÀ DV Ô TÔ VINAK,"Phường Liêm Chính, TP Phủ Lý, Hà Nam",916706168,Hà Nam,Multibrand,Bảo Minh
1145,1215,CÔNG TY TNHH 9A,CÔNG TY TNHH 9A,"Tổ 3, Hai Bà Trưng, Phủ Lý, Hà Nam",975091076,Hà Nam,Multibrand,Bảo Minh
1146,1216,CÔNG TY TNHH KERAMIC HÀ NAM,CÔNG TY TNHH KERAMIC HÀ NAM,"Trần Văn Chuông, Bình Mỹ, Bình Lục, Hà Nam",905266070,Hà Nam,Multibrand,Bảo Minh
1147,1217,HỘ KINH DOANH LÊ VĂN TUYỂN,HỘ KINH DOANH LÊ VĂN TUYỂN,"Đường Lê Hoàn, Phường Quang Trung, Phủ Lý,
 Hà Nam",912078165,Hà Nam,Multibrand,Bảo Minh
1148,1218,HỘ KINH DOANH NGUYỄN XUÂN TÌNH,HỘ KINH DOANH NGUYỄN XUÂN TÌNH,"KĐT Lam Hạ, Phủ Lý, Hà Nam",985383355,Hà Nam,Multibrand,Bảo Minh
1149,1219,CÔNG TY TNHH TM VÀ XD MAI QUÝ,CÔNG TY TNHH TM VÀ XD MAI QUÝ,"La Mát, Kiện Khê, Thanh Liêm, Hà Nam",912854657,Hà Nam,Multibrand,Bảo Minh
1150,1220,CÔNG TY TNHH T29,CÔNG TY TNHH T29,"Thanh Châu, Phủ Lý, Hà Nam",963897568,Hà Nam,Multibrand,Bảo Minh
1151,1221,HỘ KINH DOANH ĐINH THỊ HINH,HỘ KINH DOANH ĐINH THỊ HINH,"Hòa Xá, Ứng Hòa, Hà Nội",912826589,Hà Nam,Multibrand,Bảo Minh
1152,1222,CÔNG TY TNHH SỬA CHỮA Ô TÔ HẢI HÙNG,CÔNG TY TNHH SỬA CHỮA Ô TÔ HẢI HÙNG,"Trần Hưng Đạo, Phủ Lý, Hà Nam",916969688,Hà Nam,Multibrand,Bảo Minh
1153,1223,CÔNG TY TNHH 102 HÀ NAM,CÔNG TY TNHH 102 HÀ NAM,"Đường Lý Thái Tổ, Châu Sơn, Phủ Lý, Hà Nam",96711191,Hà Nam,Multibrand,Bảo Minh
1154,1224,"CÔNG TY CP Ô TÔ TRƯỜNG HẢI- CN GIẢI
 PHÓNG","CÔNG TY CP Ô TÔ TRƯỜNG HẢI- CN GIẢI
 PHÓNG","Xã Tứ Hiệp, huyện Thanh Trì, Hà Nội",938907416,Hà Nam,Multibrand,Bảo Minh
1155,1225,CÔNG TY TNHH MẠNH QUANG,CÔNG TY TNHH MẠNH QUANG,"Thanh Hà, Thanh Liêm, Hà Nam",912888177,Hà Nam,Multibrand,Bảo Minh
1156,1226,CÔNG TY TNHH DỊCH VỤ SỬA CHỮA 115,CÔNG TY TNHH DỊCH VỤ SỬA CHỮA 115,"Tiên Tân, Phủ Lý, Hà Nam",936633115,Hà Nam,Multibrand,Bảo Minh
1157,1227,"CÔNG TY CP TMDV Ô TÔ HÒA BÌNH MINH
 HN","CÔNG TY CP TMDV Ô TÔ HÒA BÌNH MINH
 HN","Phủ Lý, Hà Nam",968972137,Hà Nam,Multibrand,Bảo Minh
1158,1228,CÔNG TY TNHH ĐÔNG ĐÔ,CÔNG TY TNHH ĐÔNG ĐÔ,"446 Nguyễn Lương Bằng, p. Thanh Bình, Tp Hải
 Dương",800256875,Hải Dương,Multibrand,Bảo Minh
1159,1229,CÔNG TY TNHH TÂY ĐÔ HẢI DƯƠNG,CÔNG TY TNHH TÂY ĐÔ HẢI DƯƠNG,"Số 13, Nguyễn Trung Trực, P. Lê Thanh Nghị, Tp
 Hải Dương",801137567,Hải Dương,Multibrand,Bảo Minh
1160,1230,HTX CƠ KHÍ HẢI HÀ,HTX CƠ KHÍ HẢI HÀ,"Km+500 đường Nguyễn Lương Bằng, Phường
 Thanh Bình, TP. Hải Dương, Hải Dương",915041989,Hải Dương,Multibrand,Bảo Minh
1161,1231,CÔNG TY TNHH BÌNH AN PHÁT HNH,CÔNG TY TNHH BÌNH AN PHÁT HNH,"6/9 Cô Đoài, Khu 1, P. Cẩm Thượng, Tp Hải
 Dương",989149505,Hải Dương,Multibrand,Bảo Minh
1162,1232,CÔNG TY TNHH MTV QUANG THÀNH HD,CÔNG TY TNHH MTV QUANG THÀNH HD,"Lô 100.4 TRường Chinh, P. Tứ Minh, Tp Hải
 Dương",914925381,Hải Dương,Multibrand,Bảo Minh
1163,1233,CÔNG TY TNHH DIỆP ANH HD,CÔNG TY TNHH DIỆP ANH HD,"Số 18 phố Cô Đông, P.Bình Hàn,Tp Hải Dương",345064462,Hải Dương,Multibrand,Bảo Minh
1164,1234,CÔNG TY TNHH MTV DỊCH VỤ Ô TÔ CTD,CÔNG TY TNHH MTV DỊCH VỤ Ô TÔ CTD,"166 Đỗ Ngọc Du, phường Thanh Bình, Tp Hải
 Dương",974118896,Hải Dương,Multibrand,Bảo Minh
1165,1235,CÔNG TY CP DVTM & XD ĐÔNG DƯƠNG,CÔNG TY CP DVTM & XD ĐÔNG DƯƠNG,"Phường Văn An, Tp Chí Linh, tỉnh Hải Dương",914971680,Hải Dương,Multibrand,Bảo Minh
1166,1236,CÔNG TY TNHH DUY TÂN,CÔNG TY TNHH DUY TÂN,"Km 48 + 800 quốc lộ 5, phường Việt Hòa, TP Hải
 Dương",800290298,Hải Dương,Multibrand,Bảo Minh
1167,1237,CÔNG TY TNHH 79,CÔNG TY TNHH 79,"179 Đinh Văn Tả, phường Bình Hàn, TP Hải
 Dương",,Hải Dương,Multibrand,Bảo Minh
1168,1238,CÔNG TY CP TMSX HOÀNG GIA PHÁT,CÔNG TY CP TMSX HOÀNG GIA PHÁT,"Lý Dương, Vĩnh hồng, Bình Giang, Hải Dương",982784333,Hải Dương,Multibrand,Bảo Minh
1169,1239,CÔNG TY CƠ GIỚI VÀ XÂY DỰNG HÒA BÌNH,CÔNG TY CƠ GIỚI VÀ XÂY DỰNG HÒA BÌNH,"Km 46+800, QL5, P. Tứ Minh, Tp Hải Dương,",913256006,Hải Dương,Multibrand,Bảo Minh
1170,1240,(TNHH),TNHH,tỉnh Hải Dương,,Hải Dương,Multibrand,Bảo Minh
1171,1241,CÔNG TY TNHH KIM NGƯU CAR,CÔNG TY TNHH KIM NGƯU CAR,"Gara: Số 6, BT6 Trần Quốc Lặc , phường Quang
 Trung, TP HD",988792266,Hải Dương,Multibrand,Bảo Minh
1172,1242,CÔNG TY TNHH HOÀNG HIỆP HD,CÔNG TY TNHH HOÀNG HIỆP HD,"225 Trương Mỹ, P. Phạm Ngũ Lão, Tp Hải
 Dương",974118896,Hải Dương,Multibrand,Bảo Minh
1173,1243,CÔNG TY TNHH TM VÀ DỊCH VỤ DUNG HÀ,CÔNG TY TNHH TM VÀ DỊCH VỤ DUNG HÀ,"Thôn 1, xã Thanh Xá, huyện Thanh Hà, Tỉnh Hải
 Dương",982723686,Hải Dương,Multibrand,Bảo Minh
1174,1244,CÔNG TY CP TM&DV THẢO LINH HD,CÔNG TY CP TM&DV THẢO LINH HD,"Km63, QL37, Đồng Lạc Nam Sách, Hải Dương",912978975,Hải Dương,Multibrand,Bảo Minh
1175,1245,GARA Ô TÔ QUỲNH PHƯƠNG,GARA Ô TÔ QUỲNH PHƯƠNG,"KDC Ninh Chấp 7, P. Thái Học, TX Chí Linh, Hải
 Dương",977509666,Hải Dương,Multibrand,Bảo Minh
1176,1246,GARA Ô TÔ KHOA SƠN,GARA Ô TÔ KHOA SƠN,"Khu Phụ Sơn, TT Kinh Môn, Kinh Môn, HD",963456619,Hải Dương,Multibrand,Bảo Minh
1177,1247,CÔNG TY TNHH TMDV Ô TÔ PHẠM GIA,CÔNG TY TNHH TMDV Ô TÔ PHẠM GIA,"Thôn Thanh Kỳ, xã An Thanh, huyện Tứ Kỳ, tỉnh
 Hải Dương",,Hải Dương,Multibrand,Bảo Minh
1178,1248,CÔNG TY TNHH MTV ĐỖ BẢO AUTO,CÔNG TY TNHH MTV ĐỖ BẢO AUTO,"Khu 15, TT Lai Cách, huyện Cẩm Giàng, tỉnh Hải
 Dương",2203859412,Hải Dương,Multibrand,Bảo Minh
1179,1249,CÔNG TY TNHH Ô TÔ 99,CÔNG TY TNHH Ô TÔ 99,"Số 126 Nguyễn Lương Bằng, P. Phạm Ngũ Lão,
 Tp Hải Dương",902086118,Hải Dương,Multibrand,Bảo Minh
1180,1250,GARA Ô TÔ NAM VÂN,GARA Ô TÔ NAM VÂN,"Thanh Thủy, Thanh Hà, Hải Dương",985505490,Hải Dương,Multibrand,Bảo Minh
1181,1251,CÔNG TY TNHH TM&SX DUNG HÙNG,CÔNG TY TNHH TM&SX DUNG HÙNG,"Sôố 471 đường Trường Chinh, Khu 5 Đức Minh,
 P. Thanh Bình, Tp Hải Dương",982891364,Hải Dương,Multibrand,Bảo Minh
1182,1252,CÔNG TY CP ĐT VÀ TMDV BẢO TÍN,CÔNG TY CP ĐT VÀ TMDV BẢO TÍN,"Thôn An Tân, xã Gia Tân, huyện Gia Lộc, tỉnh Hải
 Dương",825238238,Hải Dương,Multibrand,Bảo Minh
1183,1253,HTX MINH TRUNG,HTX MINH TRUNG,"Cẩm Khê, Tứ Minh, TP Hải Dương",2203891759,Hải Dương,Multibrand,Bảo Minh
1184,1254,CÔNG TY TNHH TRUNG HIẾU HD,CÔNG TY TNHH TRUNG HIẾU HD,"Số 643 Lê Thanh Nghị, P. Lê Thanh Nghị, Tp HD",963921001,Hải Dương,Multibrand,Bảo Minh
1185,1255,"CÔNG TY TNHH DV & TM CƠ KHÍ Ô TÔ
 PHƯƠNG LÂM","CÔNG TY TNHH DV & TM CƠ KHÍ Ô TÔ
 PHƯƠNG LÂM","KDC Minh Tân, P. Minh Tân, TX. Kinh Môn, Hải
 Dương",936792682,Hải Dương,Multibrand,Bảo Minh
1186,1256,"CÔNG TY TNHH SỬA CHỮA Ô TÔ QUANG
 CẢNH","CÔNG TY TNHH SỬA CHỮA Ô TÔ QUANG
 CẢNH","Số 341 đường Vũ Khâm Lân, Phường Hải Tân,
 Tp Hải Dương",989909276,Hải Dương,Multibrand,Bảo Minh
1187,1257,CÔNG TY TNHH Ô TÔ QUÂN NGUYÊN,CÔNG TY TNHH Ô TÔ QUÂN NGUYÊN,"Khu Bích Nhôi 3, P. Minh Tân, Thị Xã Kinh Môn,
 Tỉnh Hải Dương",912757535,Hải Dương,Multibrand,Bảo Minh
1188,1258,CÔNG TY TNHH DỊCH VỤ Ô TÔ PHÚC ANH,CÔNG TY TNHH DỊCH VỤ Ô TÔ PHÚC ANH,"Số 546 Trường Chinh, P.Quán Trữ, Q.Kiến An, TP
 Hải Phòng",858530555,Hải Phòng,Multibrand,Bảo Minh
1189,1259,"CÔNG TY TNHH THƯƠNG MẠI VÀ SỬA
 CHỮA Ô TÔ NHẬT QUANG","CÔNG TY TNHH THƯƠNG MẠI VÀ SỬA
 CHỮA Ô TÔ NHẬT QUANG","Số 9, khu B5 Lô 7, Đường Lê Hồng Phong,
 P.Đông Khê, Q.Ngô Quyền, TP Hải Phòng",919198796,Hải Phòng,Multibrand,Bảo Minh
1190,1260,CÔNG TY TNHH THƯƠNG MẠI DỊCH VỤ Ô TÔ KHÁNH MINH,CÔNG TY TNHH THƯƠNG MẠI DỊCH VỤ Ô TÔ KHÁNH MINH,"Số 261, Quán Rẽ, xã Mỹ Đức, Huyện An Lão, TP Hải Phòng.",935248888,Hải Phòng,Multibrand,Bảo Minh
1191,1261,CÔNG TY TNHH QUỐC THỊNH PHÁT,CÔNG TY TNHH QUỐC THỊNH PHÁT,"Số 104 Nguyễn Bỉnh Khiêm, Đông Hải1, Hải AN,
 Hải Phòng",936054137,Hải Phòng,Multibrand,Bảo Minh
1192,1262,"CÔNG TY TNHH TM&DV SỬA CHỮA Ô TÔ
 NGỌC THẮNG","CÔNG TY TNHH TM&DV SỬA CHỮA Ô TÔ
 NGỌC THẮNG","Số 4 Lê Hồng Phong, Quận Ngô Quyền, TP Hải
 Phòng","0901.537.286 -
 0934.888.333",Hải Phòng,Multibrand,Bảo Minh
1193,1263,CÔNG TY CP Ô TÔ HỒNG ĐỨC,CÔNG TY CP Ô TÔ HỒNG ĐỨC,"Số 363 Nguyễn Văn Linh, P.Kênh Dương, Quận
 Lê Chân, TP Hải Phòng",2253795957,Hải Phòng,Multibrand,Bảo Minh
