,Unnamed: 0,Company,Name Gara,Address,Phone,Province,Brand,Liên kết
0,0,Công ty TNHH Toyota Thanh Xuân,Toyota Thanh Xuân,315 Trường Chinh – Đống Đa – Hà Nội.,0435.656.666,Hà Nội,Toyota,PJICO
1,1,Công ty TNHH MTV Toyota Mỹ Đình,Toyota Mỹ Đình,15 Phạm Hùng - Mỹ Đình - Hà Nội,043.768.666,Hà Nội,Toyota,PJICO
2,2,Công ty TNHH MTV Toyota Mỹ Đình – Chi nhánh cầu diễn (Toyota Cầu diễn),Toyota Cầu diễn,Km10 + 100 QL 32 TT Cầu Diễn - Từ Liêm - Hà Nội.,,Hà Nội,Toyota,PJICO
3,3,Công ty TNHH Toyota Long Biên,TOYOTA LONG BIÊN,Số 7-9 Nguyễn Văn Linh - Gia Thụy - Long Biên - Hà Nội,2403636363,Hà Nội,Toyota,PJICO
4,4,Xí nghiệp Toyota Hoàn Kiếm Hà Nội,Toyota Hoàn Kiếm Hà Nội,"Số 7, Phố Đặng Thái Thân, Phan Chu Trinh, Hoàn Kiếm",,Hà Nội,Toyota,PJICO
5,5,Công ty liên doanh Toyota Giải Phóng,Toyota Giải Phóng,"807 Giải Phóng, hoàng Mai, HN",436640124,Hà Nội,Toyota,PJICO
6,6,Chi nhánh liên doanh Toyota Giải Phóng- Chi nhánh pháp vân,Toyota Giải Phóng- Chi nhánh pháp vân,"Hoàng Liệt Hoàng Mai, HN",,Hà Nội,Toyota,PJICO
7,7,Công ty cổ phần Toyota IDMC Hoài Đức,Toyota IDMC Hoài Đức,"Km 15 + 575 Quốc lộ 32, Thị Trấn Trạm Trôi, Huyện Hoài Đức, TP Hà Nội, Việt Nam",,Hà Nội,Toyota,PJICO
8,8,Công ty cổ phần Toyota Thăng Long,Toyota Thăng Long,"Số 316 Cầu Giấy, Dịch Vọng, Cầu Giấy, Hà Nội",,Hà Nội,Toyota,PJICO
9,9,Công ty Cổ phần Toyota Thái Hòa Từ Liêm,Toyota Thái Hòa Từ Liêm,"Ngã 3 Tố Hữu, Mộ Lao, P.Đại Mỗ, Nam Từ Liêm, HN",,Hà Nội,Toyota,PJICO
10,10,Công ty cổ phần đầu tư kinh doanh tổng hợp D&C (Honda Mỹ Đình),Honda Mỹ Đình,"Số 2, đường Lê Đức Thọ, Phường Mai Dịch, Q. Cầu Giấy, Tp. Hà Nội, VN",,Hà Nội,Honda,PJICO
11,11,Công ty TNHH MTV Kinh doanh ô tô Thăng Long ( Thăng Long Ford),Thăng Long Ford,105 Láng Hạ - Đống Đa – Hà Nội,,Hà Nội,Ford,PJICO
12,12,Công ty cổ phần kinh doanh Ô tô Thủ Đô (Ford Thủ Đô),Ford Thủ Đô,Km số 8 đường Giải Phóng Pháp Vân – Hoàng Liệt - Hoàng Mai – Hà Nội,2436811888,Hà Nội,Ford,PJICO
13,13,Công ty TNHH MTV kinh doanh ô tô Thanh Xuân (Thanh Xuân Ford),Thanh Xuân Ford,"88 Nguyễn Xiển – Hạ Đình - Thanh Xuân
  – Hà Nội",,Hà Nội,Ford,PJICO
14,14,Công ty CP Hà Thành ô tô (Ford Hà Thành),Ford Hà Thành,Số 2 Tôn Thất Thuyết,2433662566,Hà Nội,Ford,PJICO
15,15,Công ty TNHH MTV kinh doanh và dịch vụ ô tô Long Biên (Ford Long Biên),Ford Long Biên,"3 Nguyễn Văn Linh, Long Biên, HN",024 3576 3333,Hà Nội,Ford,PJICO
16,16,Công ty TNHH MTV Kinh Doanh và dịch vụ ô tô Hà Nội (Ford HN),Ford HN,313 Trường Chinh – Đống Đa – Hà Nội.,,Hà Nội,Ford,PJICO
17,17,Xí nghiệp sửa chữa ô tô Tây Mỗ - Chi nhánh Công ty cổ phần AHD Thăng Long (Ford Tây Mỗ),Ford Tây Mỗ,"Tổ dân phố Nhuệ Giang, Phường Tây Mỗ, Q. Nam Từ Liêm, Hà Nội",437653488,Hà Nội,Ford,PJICO
18,18,Công ty cổ phần truyền thông và dữ liệu thanh toán An Du (Mercedes An Du),Mercedes An Du,11 Phạm Hùng - Mỹ Đình - Hà Nội,2437686762,Hà Nội,Mercedes,PJICO
19,19,Công ty TNHH ô tô Ngôi Sao Việt Nam (Mercedes Ngôi Sao),Mercedes Ngôi Sao,"Lô D5-1, khu công nghiệp Hà Nội - Đài Tư, Q. Long Biên, Hà Nội",,Hà Nội,Mercedes,PJICO
20,20,Chi nhánh công ty CP DV ô tô Hàng Xanh tại Hà Nội (Mercedes Haxaco),Mercedes Haxaco,"Số 46 Láng Hạ, Phường Láng Hạ, Quận Đống Đa,TP Hà Nội.",,Hà Nội,Mercedes,PJICO
21,21,Mercedes Haxaco Kim Giang,Mercedes Haxaco Kim Giang,"256 Kim Giang, Đại Kim, Hoàng Mai, HN",,Hà Nội,Mercedes,PJICO
22,22,Công ty CP Nacen Service (Mercedes NacenService),Mercedes NacenService,Lô 2 - Số 1 - Lê Quang Đạo - Mỹ Đình - Hà Nội,,Hà Nội,Mercedes,PJICO
23,23,Công ty cổ phần XNK Công Nghệ Nacenimex (Mercedes Nacenimex),Mercedes Nacenimex,"32 Đại Từ, Hoàng Mai, Hà Nội.",,Hà Nội,Mercedes,PJICO
24,24,Công ty cổ phần ô tô Ngôi sao Hà nội (Mercedes Hà Nội),Mercedes Hà Nội,"93 đường Thạch Bàn, phường Thạc Bàn, quận Long Biên, TP Hà Nội",,Hà Nội,Mercedes,PJICO
25,25,Công ty TNHH Motor N.A Việt Nam (Honda Tây Hồ),Honda Tây Hồ,"197A đường Nghi Tàm – Yên Phụ - 
 Tây Hồ - Hà Nội",,Hà Nội,Honda,PJICO
26,26,Công ty cổ phần tập đoàn Thái Bình - Chi nhánh Hoàng Mai (Honda Giải Phóng),Honda Giải Phóng,Km 9 - QL 1A - P. Hoàng Liệt - Q Hoàng Mai - Hà Nội,,Hà Nội,Honda,PJICO
27,27,Honda ô tô Long biên,Honda ô tô Long biên,"447 Nguyễn Văn Linh, Phúc Đồng, Long biên, Hà nội",,Hà Nội,Honda,PJICO
28,28,Mitshubishi Kim liên Hà nội,Mitshubishi Kim liên Hà nội,"26 Phạm Văn Đồng, Xuân Đỉnh, Bắc Từ Liêm, HN",,Hà Nội,Mitsubishi,PJICO
29,29,Mitshubishi Cầu Diễn,Mitshubishi Cầu Diễn,"Tổ 15, Phường Phúc Diễn, Q. Bắc Từ Liêm, TP Hà Nội",,Hà Nội,Mitsubishi,PJICO
30,30,Mitshubishi An Dân,Mitshubishi An Dân,"Số 1, Nguyễn Văn Linh, Gia Thụy, Q. Long Biên, Hà Nội",,Hà Nội,Mitsubishi,PJICO
31,31,Công ty cổ phần AHCOM Long Biên (Nissan Long Biên),Nissan Long Biên,467 Nguyễn Văn Linh – phường Phúc Đồng - quận Long Biên – Hà Nội,,Hà Nội,Nissan,PJICO
32,32,Công ty cổ phần ô tô Thành An (Hyundai Long Biên),Hyundai Long Biên,Tổ 24 – TT Đông Anh – huyện Đông Anh – TP Hà Nội,2438736097,Hà Nội,Hyundai,PJICO
33,33,Công ty cổ phần ô tô Thành Công Đông Anh (Huyndai Đông Anh),Huyndai Đông Anh,"Tổ 25, Thị trấn Đông Anh, Huyện Đông Anh, Hà Nội",,Hà Nội,Hyundai,PJICO
34,34,Hyundai Lê Văn Lương,Hyundai Lê Văn Lương,"Số 3, Vũ Phạm Hàm, Trung Hòa, Cầu Giấy, HN",,Hà Nội,Hyundai,PJICO
35,35,Hyundai Đông Đô,Hyundai Đông Đô,"987 Tam Chinh, Yên Sở, Hoàng Mai, Hà nội",,Hà Nội,Hyundai,PJICO
36,36,Nissan Phạm Văn Đồng,Nissan Phạm Văn Đồng,"26 Phạm Văn Đồng, Bắc Từ Liêm, HN",,Hà Nội,Nissan,PJICO
37,37,Mazda Lê Văn Lương,Mazda Lê Văn Lương,"105 Nguyễn Tuân, Thanh Xuân, HN",,Hà Nội,Mazda,PJICO
38,38,Mazda Nguyễn Trãi,Mazda Nguyễn Trãi,"497 Nguyễn Trãi, Thanh Xuân, HN",,Hà Nội,Mazda,PJICO
39,39,Mazda Giải Phóng,Mazda Giải Phóng,"Số 5, đường Ngọc Hồi, P. Hoàng Liệt, Q. Hoàng Mai, TP. Hà Nội",,Hà Nội,Mazda,PJICO
40,40,Mazda Long Biên,Mazda Long Biên,"Khu A, nhà máy Z133, Tổ 32, Đường Ngọc Thụy, P. Ngọc Thụy, Long Biên, Hà Nội",,Hà Nội,Mazda,PJICO
41,41,Mazda Trần Khát Chân,Mazda Trần Khát Chân,"Số 07, đường Lương Yên, Phường Bạch Đằng, Q. Hai Bà Trưng, HN",,Hà Nội,Mazda,PJICO
42,42,Vinfast - Chevrolet Hà Nội,Chevrolet Hà Nội,"948 Quang Trung kéo dài, phường Yên Nghĩa, quận Hà Đông, thành phố Hà Nội",,Hà Nội,Chevrolet,PJICO
43,43,Vinfast - Chevrolet Đại Việt,Chevrolet Đại Việt,"Số 1 Nguyễn Văn Linh, Long Biên, HN",,Hà Nội,Chevrolet,PJICO
44,44,Vinfast - Chevrolet Thăng Long,Chevrolet Thăng Long,"68 Trịnh Văn Bô, Nam Từ Liêm, HN",,Hà Nội,Chevrolet,PJICO
45,45,Vinfast - Chevrolet Newway,Chevrolet Newway,"183 Yên Lãng, HN",,Hà Nội,Chevrolet,PJICO
46,46,Vinfast Mỹ Đình,Vinfast Mỹ Đình,"Số 8 Phạm Hùng, Phường Mai Dịch, Quận Cầu Giấy, Hà Nội",,Hà Nội,Vinfast,PJICO
47,47,Vinfast Hà Thành,Vinfast Hà Thành,"162 Trường Chinh, Khương Thượng, Đống Đa, Hà Nội",,Hà Nội,Vinfast,PJICO
48,48,Peugeot Thanh Xuân,Peugeot Thanh Xuân,"Số 12, Đường Khuất Duy Tiến, Phường Thanh Xuân Trung, Q. Thanh Xuân, HN",024 7306 9026,Hà Nội,Peugeot,PJICO
49,49,Peugeot Giải Phóng,Peugeot Giải Phóng,"Km 10, Đường Giải Phóng, xã Tứ Hiệp, Huyện Thanh Trì, TP. Hà Nội",,Hà Nội,Peugeot,PJICO
50,50,Peugeot Long Biên,Peugeot Long Biên,"Số 541, Nguyễn Văn Cừ, Gia Thụy, Long Biên, Hà Nội",,Hà Nội,Peugeot,PJICO
51,51,BMW Long Biên,BMW Long Biên,"Số 1, Đường Ngô Gia Tự, Phường Đức Giang, Q. Long Biên, Hà Nội",,Hà Nội,Bmw,PJICO
52,52,CTCP thế giới thiết bị (Kia Bạch Đằng),Kia Bạch Đằng,"315 - Nguyễn Khoái, Hai Bà Trưng, Hà Nội",,Hà Nội,Kia,PJICO
53,53,Công ty CP DĐT phát triển thương mại Trang An (kia Đống Đa),kia Đống Đa,568 Đường Láng – Đống Đa – Hà Nội,0437.762.583,Hà Nội,Kia,PJICO
54,54,Chi Nhánh Long Biên - Công Ty Cổ Phần ô tô Trường Hải (kia Long Biên),kia Long Biên,"2A Ngô Gia Tự, P.Đức Giang, Q.Long Biên, TP.Hà Nội",,Hà Nội,Kia,PJICO
55,55,CN Giải Phóng – CT CP ô tô Trường Hải (Kia Giải Phóng),Kia Giải Phóng,"Km10 Giải Phóng, Thanh Trì, Hà Nội",,Hà Nội,Kia,PJICO
56,56,CN bắc Từ Liêm Hà Nội – CTCP ô tô Trường Hải (Kia Phạm Văn Đồng),Kia Phạm Văn Đồng,"Lô CC2, KĐT thành phố Giao Lưu, Cổ Nhuế 1, Bắc Từ Liêm, Hà Nội",,Hà Nội,Kia,PJICO
57,57,Kia Hà Đông,Kia Hà Đông,"Số 889, Tổ 9, Phường Phú Lãm, Quận Hà Đông, Hà Nội",,Hà Nội,Kia,PJICO
58,58,Công ty TNHH DV và Cơ khí Hải Đăng (gara Hải Đăng):,gara Hải Đăng):,Tổ 20 – P.Sài Đồng – Q.Long Biên – Hà Nội,,Hà Nội,Multibrand,PJICO
59,59,Công ty TNHH ô tô Đức Tùng (gara Đức Tùng),gara Đức Tùng,Số 2 - Lãng Yên - Hai Bà Trưng - Hà Nội,,Hà Nội,Multibrand,PJICO
60,60,Công ty CP TM & DV sửa chữa ô tô Petrolimex (gara Petrolimex),gara Petrolimex,49 đường Đức Giang – Long Biên – Hà nội,,Hà Nội,Multibrand,PJICO
61,61,Công ty cổ phần dịch vụ ô tô Toàn Cầu (gara Toàn Cầu),gara Toàn Cầu,"Số 3, lô 8 đường Nguyễn Văn Linh, Long Biên, Hà Nội",,Hà Nội,Multibrand,PJICO
62,62,Công ty cổ phần Vi auto (gara Viauto),gara Viauto,"Số 10 Lê Quang Đạo, Phường Mỹ Đình 1, Nam Từ Liêm, Hà Nội",,Hà Nội,Multibrand,PJICO
63,63,Gara Đức Lợi,Gara Đức Lợi,"233 Lê Duẩn, Hai Bà Trưng, HN",,Hà Nội,Multibrand,PJICO
64,64,Gara Bệnh viện xe hơi,Gara Bệnh viện xe hơi,584 Lạc Long Quân,,Hà Nội,Multibrand,PJICO
65,65,Gara Trung Lân,Gara Trung Lân,"Ngõ 3, Tôn Thất Thuyết, Cầu Giấy, HN",,Hà Nội,Multibrand,PJICO
66,66,Công ty cổ phần đầu tư thương mại Quang Đức (gara Quang Đức),gara Quang Đức,1075 đường Giải Phóng - Hoàng Mai – Hà Nội,,Hà Nội,Multibrand,PJICO
67,67,Công ty CP DV TM Trường Phát (gara Trường Phát),gara Trường Phát,11/538 Đường Láng – Đống Đa – Hà Nội.,,Hà Nội,Multibrand,PJICO
68,68,Công ty cổ phần dịch vụ và thương mại Trường Phát Thăng Long,Công ty cổ phần dịch vụ và thương mại Trường Phát Thăng Long,"Khu B, Đường Tân Xuân, Phường Đông Ngạc, Q. Bắc Từ Liêm, TP. Hà Nội",,Hà Nội,Multibrand,PJICO
69,69,Công ty TNHH ô Tô HTC Hà Nội,Công ty TNHH ô Tô HTC Hà Nội,"Số 11A, Phố Dịch Vọng, P. Dịch Vọng Hậu, Q. Cầu Giấy, Hà Nội",,Hà Nội,Multibrand,PJICO
70,70,Công ty cổ phần Thương Mại và Dịch vụ ô tô TCT,Công ty cổ phần Thương Mại và Dịch vụ ô tô TCT,"Số 3, Ngõ 87, Phố Lê Thanh Nghị, Phường Đồng Tâm, Q. Hai Bà Trưng, Hà Nội",,Hà Nội,Multibrand,PJICO
71,71,Hino Việt Đăng,Hino Việt Đăng,"Km số 3, Đường Phan Trọng Tuệ, Xã Tam Hiệp, Huyện Thanh Trì, Hà Nội",,Hà Nội,Multibrand,PJICO
72,72,Trung Đại Tu,Trung Đại Tu,"158 Phan Trọng Tuệ, Thanh Liệt, Thanh Trì, Hà Nội",,Hà Nội,Multibrand,PJICO
73,73,Minh Quốc Trí,Minh Quốc Trí,"Số 5, Ngách 174/18 Đường Lạc Long Quân, Phường Bưởi, Q. Tây Hồ, Hà Nội",,Hà Nội,Multibrand,PJICO
74,74,Lexus Thăng long,Lexus Thăng long,"Ngã tư Phạm Hùng, Dương Đình Nghệ, tổ dân phố số 8, phường Mỹ Đình 1, Q. Nam Từ Liêm, Tp. Hà Nội",,Hà Nội,Lexus,PJICO
75,75,CHEVROLET VIỆT LONG,CHEVROLET VIỆT LONG,"936 QL1A, P. Thạnh Xuân",,Tp Hcm,Chevrolet,PJICO
76,76,CHEVROLET AN THÁI,CHEVROLET AN THÁI,464 Kinh Dương Vương,,Tp Hcm,Chevrolet,PJICO
77,77,CITY FORD,CITY FORD,"260 QL13, P Hiệp Bình Chánh",08 66803257,Tp Hcm,Ford,PJICO
78,78,FORD BẾN THÀNH,FORD BẾN THÀNH,831 Trường Chinh,,Tp Hcm,Ford,PJICO
79,79,FORD GIA ĐỊNH,FORD GIA ĐỊNH,900 QL1a,,Tp Hcm,Ford,PJICO
80,80,FORD PHÚ MỸ,FORD PHÚ MỸ,"KCN Cát Lái 2, P Thạnh Mỹ Lợi",,Tp Hcm,Ford,PJICO
81,81,FORD TÂY,FORD TÂY,"530 Kinh Dương Vương, P An Lạc.",,Tp Hcm,Ford,PJICO
82,82,SÀI GÒN FORD,SÀI GÒN FORD,"61A Cao Thắng, P3",,Tp Hcm,Ford,PJICO
83,83,GARAGE AN PHÚ,GARAGE AN PHÚ,"Số 2 , đường 18, P. An Phú",,Tp Hcm,Multibrand,PJICO
84,84,GARAGE ANYCAR,GARAGE ANYCAR,250 Lương Đình Của,,Tp Hcm,Multibrand,PJICO
85,85,GARAGE AUTO PHÚ MỸ,GARAGE AUTO PHÚ MỸ,714 Huỳnh Tấn Phát,,Tp Hcm,Multibrand,PJICO
86,86,GARAGE AUTOMEX,GARAGE AUTOMEX,76 Tân Hóa - P13,,Tp Hcm,Multibrand,PJICO
87,87,GARAGE BÁ THÀNH,GARAGE BÁ THÀNH,"462 Phan Văn Trị, P.7",,Tp Hcm,Multibrand,PJICO
88,88,GARAGE CHEVROLET HỢP LỰC,GARAGE CHEVROLET HỢP LỰC,47/6 Kênh Tân Hóa,,Tp Hcm,Chevrolet,PJICO
89,89,GARAGE CHÍNH HIỆP,GARAGE CHÍNH HIỆP,"39 Đỗ Quang, P. Thảo Điền",,Tp Hcm,Multibrand,PJICO
90,90,GARAGE CHÍNH HIỆP,GARAGE CHÍNH HIỆP,"14 Trần Quốc Tuấn, P.1",,Tp Hcm,Multibrand,PJICO
91,91,GARAGE ĐẠI PHÚ,GARAGE ĐẠI PHÚ,Đào Trí,,Tp Hcm,Multibrand,PJICO
92,92,GARAGE GIA ĐÌNH VIỆT,GARAGE GIA ĐÌNH VIỆT,"102 Phổ Quang, P2",,Tp Hcm,Multibrand,PJICO
93,93,GARAGE LTK BÌNH TRIỆU,GARAGE LTK BÌNH TRIỆU,"188/1 QL13, P. Hiệp Bình Chánh",,Tp Hcm,Multibrand,PJICO
94,94,GARAGE MÊ KONG XANH,GARAGE MÊ KONG XANH,15 Đào Duy Anh,,Tp Hcm,Multibrand,PJICO
95,95,GARAGE MINH ĐỨC,GARAGE MINH ĐỨC,"106/10, Điện Biên Phủ, P17",,Tp Hcm,Multibrand,PJICO
96,96,GARAGE MINH PHÁT,GARAGE MINH PHÁT,"53/6A Phạm Văn Chiêu, P14",,Tp Hcm,Multibrand,PJICO
97,97,GARAGE NGUYÊN GIA PHÁT,GARAGE NGUYÊN GIA PHÁT,"Lái Thiêu, Thuận An, Bình Dương",,Tp Hcm,Multibrand,PJICO
98,98,GARAGE NGUYỄN TRỨ,GARAGE NGUYỄN TRỨ,"217 Đại Học Nông lâm, P. Linh Trung",,Tp Hcm,Multibrand,PJICO
99,99,GARAGE Ô TÔ BÌNH LÂM,GARAGE Ô TÔ BÌNH LÂM,"384 /25 Kha Vạn Cân, P. Hiệp Bình Chánh",,Tp Hcm,Multibrand,PJICO
100,100,GARAGE Ô TÔ VIỆT,GARAGE Ô TÔ VIỆT,"296 Lê Trọng Tấn, P15",,Tp Hcm,Multibrand,PJICO
101,101,GARAGE PHÚ VINH,GARAGE PHÚ VINH,39 Nguyễn Tư Giản,,Tp Hcm,Multibrand,PJICO
102,102,GARAGE PHƯƠNG BẢO MINH,GARAGE PHƯƠNG BẢO MINH,"375-377 Tây Thạnh, P. Tây Thạnh",,Tp Hcm,Multibrand,PJICO
103,103,GARAGE PHƯƠNG NAM,GARAGE PHƯƠNG NAM,"1295B Nguyễn Thị Định, Cát Lái",,Tp Hcm,Multibrand,PJICO
104,104,GARAGE THANH HẬU,GARAGE THANH HẬU,"520A Hà Huy Giáp, P. Thạnh Lộc",,Tp Hcm,Multibrand,PJICO
105,105,GARAGE TRẦN HẠNH,GARAGE TRẦN HẠNH,158/25 Huỳnh Mẫn Đạt,,Tp Hcm,Multibrand,PJICO
106,106,GARAGE TRUNG CHÁNH,GARAGE TRUNG CHÁNH,21/7 QL22,,Tp Hcm,Multibrand,PJICO
107,107,GARAGE TRUNG PHONG,GARAGE TRUNG PHONG,1028 Phạm Thế Hiển,,Tp Hcm,Multibrand,PJICO
108,108,GARAGE TRUNG THÚY,GARAGE TRUNG THÚY,191/11 Tạ Quang Bửu,,Tp Hcm,Multibrand,PJICO
109,109,GARAGE PACIFIC AUTO,GARAGE PACIFIC AUTO,148 Trường Chinh,,Tp Hcm,Multibrand,PJICO
110,110,GARAGE TUẤN ANH,GARAGE TUẤN ANH,143 Ung Văn Khiêm,061 3559960,Tp Hcm,Multibrand,PJICO
111,111,GARAGE TUẤN DŨNG,GARAGE TUẤN DŨNG,"243 Đồng Đen, P10",,Tp Hcm,Multibrand,PJICO
112,112,GARAGE VŨ KHÔI,GARAGE VŨ KHÔI,"Quang Trung, Hiệp Phú",,Tp Hcm,Multibrand,PJICO
113,114,LANDROVER,LANDROVER,"KCN Cát Lái 2, P Thạnh Mỹ Lợi",,Tp Hcm,Multibrand,PJICO
114,115,HINO ĐẠI PHÁT TÍN,HINO ĐẠI PHÁT TÍN,"1286 QL1A, Thới An",,Tp Hcm,Multibrand,PJICO
115,116,HINO SAO BẮC,HINO SAO BẮC,"120/7B QL13, P.Hiệp Bình Phước",,Tp Hcm,Multibrand,PJICO
116,117,HONDA KIM THANH,HONDA KIM THANH,"6 đường 3/2, P15",,Tp Hcm,Honda,PJICO
117,118,HONDA CỘNG HÒA,HONDA CỘNG HÒA,"18 Cộng Hòa, P4.",,Tp Hcm,Honda,PJICO
118,119,HONDA PHÁT TIẾN (Q2),HONDA PHÁT TIẾN (Q2),136 D Mai Chí Thọ,,Tp Hcm,Honda,PJICO
119,120,HONDA PHƯỚC THÀNH,HONDA PHƯỚC THÀNH,"1250-1252 Võ Văn Kiệt, P.10.",,Tp Hcm,Honda,PJICO
120,121,HONDA Q7,HONDA Q7,TTTM ven sông Tân Phong,,Tp Hcm,Honda,PJICO
121,122,HYUNDAI GIA ĐỊNH,HYUNDAI GIA ĐỊNH,"162 Phạm Văn Đồng, P3",,Tp Hcm,Hyundai,PJICO
122,123,HYUNDAI KINH DƯƠNG VƯƠNG,HYUNDAI KINH DƯƠNG VƯƠNG,"701 Kinh Dương Vương, P. An Lạc",,Tp Hcm,Hyundai,PJICO
123,124,HYUNDAI NGỌC AN,HYUNDAI NGỌC AN,"327 QL13, P.Hiệp Bình Phước",,Tp Hcm,Hyundai,PJICO
124,125,HYUNDAI TRƯỜNG CHINH,HYUNDAI TRƯỜNG CHINH,"18 Cộng Hòa, P4.",,Tp Hcm,Hyundai,PJICO
125,126,HYUNDAI VIỆT HÀN,HYUNDAI VIỆT HÀN,"387 QL13, P.Hiệp Bình Phước",083 7262895,Tp Hcm,Hyundai,PJICO
126,127,THACO BÌNH TÂN,THACO BÌNH TÂN,,0nan,Tp Hcm,Thaco,PJICO
127,128,THACO TRƯỜNG CHINH,THACO TRƯỜNG CHINH,827A Trường Chinh,,Tp Hcm,Thaco,PJICO
128,129,MITSUBISHI HỒNG HÀ,MITSUBISHI HỒNG HÀ,1A Hồng Hà,,Tp Hcm,Mitsubishi,PJICO
129,130,MITSUBISHI ISAMCO,MITSUBISHI ISAMCO,"139 Cô Giang, P Cô Giang",,Tp Hcm,Mitsubishi,PJICO
130,131,MITSUBISHI PHƯƠNG NGUYÊN,MITSUBISHI PHƯƠNG NGUYÊN,63A Võ Văn Kiệt,,Tp Hcm,Mitsubishi,PJICO
131,132,MITSUBISHI Q7,MITSUBISHI Q7,Huỳnh Tấn Phát,,Tp Hcm,Mitsubishi,PJICO
132,133,NISSAN GÒ VẤP,NISSAN GÒ VẤP,"786 Nguyễn Kiệm, P3",,Tp Hcm,Nissan,PJICO
133,134,NISSAN MIỀN TÂY,NISSAN MIỀN TÂY,54 Kinh Dương Vương,,Tp Hcm,Nissan,PJICO
134,135,SUZUKI NGÔI SAO,SUZUKI NGÔI SAO,"510 QL13, P. Hiệp Bình Phước",,Tp Hcm,Suzuki,PJICO
135,136,TOYOTA BẾN THÀNH,TOYOTA BẾN THÀNH,"262 Trần Hưng Đạo, P. Nguyễn Cư Trinh",,Tp Hcm,Toyota,PJICO
136,137,TOYOTA AN SƯƠNG,TOYOTA AN SƯƠNG,"382 QL22, P. Trung Mỹ Tây",37199999,Tp Hcm,Toyota,PJICO
137,138,TOYOTA AN THÀNH,TOYOTA AN THÀNH,"Bùi Thanh Khiết, TT Tân Túc",,Tp Hcm,Toyota,PJICO
138,139,TOYOTA ĐÔNG SÀI GÒN,TOYOTA ĐÔNG SÀI GÒN,507 Xa lộ HN,,Tp Hcm,Toyota,PJICO
139,140,TOYOTA HÙNG VƯƠNG,TOYOTA HÙNG VƯƠNG,26 Kinh Dương Vương,39808888,Tp Hcm,Toyota,PJICO
140,141,TOYOTA LÝ THƯỜNG KIỆT,TOYOTA LÝ THƯỜNG KIỆT,"151A Lý Thường Kiệt, P6",08 39713838,Tp Hcm,Toyota,PJICO
141,142,TOYOTA PHÚ MỸ HƯNG,TOYOTA PHÚ MỸ HƯNG,,0nan,Tp Hcm,Toyota,PJICO
142,144,GARAGE THIÊN HẢI,GARAGE THIÊN HẢI,93 Phạm Văn Chiêu,,Tp Hcm,Multibrand,PJICO
143,145,ISUZU TÂY BẮC,ISUZU TÂY BẮC,,0nan,Tp Hcm,Isuzu,PJICO
144,146,ISUZU VÂN NAM,ISUZU VÂN NAM,,0nan,Tp Hcm,Isuzu,PJICO
145,147,CÔNG TY TNHH MỘT THÀNH VIÊN BẮC NINH TRƯỜNG HẢI,CÔNG TY TNHH MỘT THÀNH VIÊN BẮC NINH TRƯỜNG HẢI,"Km3, quốc lộ 18A, Phường Đại Phúc, Thành phố Bắc Ninh, Tỉnh Bắc Ninh",02223 828 816,Bắc Ninh,Multibrand,PJICO
146,148,CÔNG TY TNHH TOYOTA BẮC NINH,TOYOTA BẮC NINH,"Lê Thái Tổ,Võ Cường,Bắc Ninh",2223686666,Bắc Ninh,Toyota,PJICO
147,149,CÔNG TY TNHH ĐẦU TƯ XÂY DỰNG VÀ THƯƠNG MẠI PHƯƠNG THẢO PHÁT,CÔNG TY TNHH ĐẦU TƯ XÂY DỰNG VÀ THƯƠNG MẠI PHƯƠNG THẢO PHÁT,"Đường Lê Thái Tổ, Thôn Hòa Đình, Phường Võ Cường, Thành Phố Bắc Ninh, Tỉnh Bắc Ninh",2223817777,Bắc Ninh,Multibrand,PJICO
148,150,CÔNG TY TNHH DƯƠNG TUẤN,CÔNG TY TNHH DƯƠNG TUẤN,Đường Lê Thái Tổ - Võ Cường - TP. Bắc Ninh - Bắc Ninh,2223636666,Bắc Ninh,Multibrand,PJICO
149,151,CÔNG TY TNHH TOYOTA LONG BIÊN,TOYOTA LONG BIÊN,"số 7 và 9 Nguyễn Văn Linh, phường Gia Thụy, Quận Long Biên, TP. Hà Nội",2403636363,Bắc Ninh,Toyota,PJICO
150,152,CÔNG TY TNHH Ô TÔ BẮC NINH,CÔNG TY TNHH Ô TÔ BẮC NINH,"Lê Thái Tổ,Võ Cường,Bắc Ninh",2223686666,Bắc Ninh,Multibrand,PJICO
151,153,CÔNG TY TNHH HAN NAM,HONDA BẮC NINH,"Lê Thái Tổ,Võ Cường,Bắc Ninh",2223686666,Bắc Ninh,Multibrand,PJICO
152,154,CÔNG TY CỔ PHẦN DỊCH VỤ Ô TÔ KINH BẮC,CÔNG TY CỔ PHẦN DỊCH VỤ Ô TÔ KINH BẮC,"Số 168 Nguyễn Công Hãng, Kinh Bắc, Bắc Ninh",968737373,Bắc Ninh,Multibrand,PJICO
153,155,CÔNG TY TNHH NICE CAR VIỆT NAM,CÔNG TY TNHH NICE CAR VIỆT NAM,"Số 95 đường Bình Than, Đại Phúc, Bắc Ninh",904986171,Bắc Ninh,Multibrand,PJICO
154,156,CÔNG TY TNHH SỬA CHỮA Ô TÔ TRẦN ĐỨC,CÔNG TY TNHH SỬA CHỮA Ô TÔ TRẦN ĐỨC,"Số 109 khu Tân Hồng, p.Tân Hồng, Từ Sơn, Bắc Ninh",222764288,Bắc Ninh,Multibrand,PJICO
155,157,CÔNG TY CỔ PHẦN TOYOTA TỪ SƠN,TOYOTA TỪ SƠN,"Số 1 đường Lý Thái Tổ, p.Tân Hồng, Từ Sơn, Bắc Ninh",2223686666,Bắc Ninh,Toyota,PJICO
156,158,CÔNG TY HÙNG HƯƠNG TNHH,CÔNG TY HÙNG HƯƠNG TNHH,"Số 10, Nguyễn Đăng Đạo, tp.Bắc Ninh",2223896553,Bắc Ninh,Multibrand,PJICO
157,159,CÔNG TY TNHH MINH THÀNH VINA,CÔNG TY TNHH MINH THÀNH VINA,"Khu 5, Đại Phúc, Bắc Ninh",984809787,Bắc Ninh,Multibrand,PJICO
158,160,Phùng Bình Ánh,Phùng Bình Ánh,"Tổ 4, P Ỷ La, TP Tuyên Quang",974256686,Tuyên Quang,Multibrand,PJICO
159,161,Hoàng Xuân Yêm,Hoàng Xuân Yêm,"Tổ 1, P Minh Xuân, TP Tuyên Quang",2073818971,Tuyên Quang,Multibrand,PJICO
160,162,Trần Văn Ngân,Trần Văn Ngân,"Tổ 13, P Tân Hà, TP Tuyên Quang",913083636,Tuyên Quang,Multibrand,PJICO
161,163,Trần Duy Thao,Trần Duy Thao,"Tổ 2, P Nông Tiến, TP Tuyên Quang",869899855,Tuyên Quang,Multibrand,PJICO
162,164,Trịnh Kế Công,Trịnh Kế Công,"Tổ 9, P Hưng Thành, TP Tuyên Quang",974354099,Tuyên Quang,Multibrand,PJICO
163,165,CÔNG TY CỔ PHẦN DANA,CÔNG TY CỔ PHẦN DANA,56 - Điện Biên Phủ - Đà Nẵng,927777943,Đà Nẵng,Multibrand,PJICO
164,166,CÔNG TY TNHH Ô TÔ THỊNH HƯNG,CÔNG TY TNHH Ô TÔ THỊNH HƯNG,Lô A2 - Nút giao thông Tuyên Sơn - đường 2/9 - Đà Nẵng,1900636854,Đà Nẵng,Multibrand,PJICO
165,167,CHI NHÁNH ĐÀ NẮNG XE THƯƠNG MẠI - CTY CP Ô TÔ TRƯỜNG HẢI,CHI NHÁNH ĐÀ NẮNG XE THƯƠNG MẠI - CTY CP Ô TÔ TRƯỜNG HẢI,"Thửa đất số 1, Tờ bản đồ số 85, Quốc lộ 1A, Thôn Quá Giáng 1, Xã Hoà Phước, Huyện Hoà Vang, Đà Nẵng",2363764495,Đà Nẵng,Multibrand,PJICO
166,168,CHI NHÁNH ĐÀ NẴNG - CÔNG TY CỔ PHẦN Ô TÔ TRƯỜNG HẢI,CHI NHÁNH ĐÀ NẴNG - CÔNG TY CỔ PHẦN Ô TÔ TRƯỜNG HẢI,"356 Điện Biên Phủ, Phường Thanh Khê Đông, Quận Thanh Khê, Đà Nẵng",2363785555,Đà Nẵng,Multibrand,PJICO
167,169,CÔNG TY TNHH TRƯỜNG HẢI ĐÀ NẴNG,CÔNG TY TNHH TRƯỜNG HẢI ĐÀ NẴNG,"Tổ 14 đường Phạm Văn Đồng, Đà Nẵng",2363785333,Đà Nẵng,Multibrand,PJICO
168,170,CÔNG TY TNHH MTV TOYOTA ĐÀ NẴNG,TOYOTA ĐÀ NẴNG,"69,71 Duy Tân, Phường Hoà Thuận Tây, Quận Hải Châu, Đà Nẵng",2363614011,Đà Nẵng,Toyota,PJICO
169,171,CÔNG TY TNHH TOYOTA OKAYANA ĐÀ NẴNG,TOYOTA OKAYANA ĐÀ NẴNG,"Số 9 - đường Phạm Hùng, Phường Hòa Xuân, Quận Cẩm Lệ, Tp Đà Nẵng",912848755,Đà Nẵng,Toyota,PJICO
170,172,CÔNG TY CỔ PHẦN Ô TÔ VẬN HỘI MỚI,CÔNG TY CỔ PHẦN Ô TÔ VẬN HỘI MỚI,"178 đường 2/9, Phường Hoà Cường Bắc, Quận Hải Châu, Đà Nẵng",2363788888,Đà Nẵng,Multibrand,PJICO
171,173,CÔNG TY CỔ PHẦN Ô TÔ SÔNG HÀN,CÔNG TY CỔ PHẦN Ô TÔ SÔNG HÀN,"86 Duy Tân, Phường Hoà Thuận Tây, Quận Hải Châu, Đà Nẵng",2363783555,Đà Nẵng,Multibrand,PJICO
172,174,CÔNG TY TNHH MTV Ô TÔ SƠN TRÀ,HYUNDAI SƠN TRÀ,286 - Phạm Hùng - Cẩm Lệ - Đà Nẵng,2363773555,Đà Nẵng,Multibrand,PJICO
173,175,CÔNG TY TNHH Ô TÔ ĐÀ NẴNG,CÔNG TY TNHH Ô TÔ ĐÀ NẴNG,02 - Nguyễn Hữu Thọ - Hải Châu - Đà Nẵng,2363778555,Đà Nẵng,Multibrand,PJICO
174,176,CÔNG TY CỔ PHẦN ĐẦU MÁY - THIẾT BỊ DẦU KHÍ ĐÀ NẴNG,CÔNG TY CỔ PHẦN ĐẦU MÁY - THIẾT BỊ DẦU KHÍ ĐÀ NẴNG,51 - Phan Đăng Lưu - Hải Châu - Đà Nẵng,2363623438,Đà Nẵng,Multibrand,PJICO
175,177,CN CTY CP TRUYỀN THÔNG VÀ DỮ LIỆU THANH TOÁN AN DU TẠI ĐÀ NẴNG,CN CTY CP TRUYỀN THÔNG VÀ DỮ LIỆU THANH TOÁN AN DU TẠI ĐÀ NẴNG,113- Nguyễn Hữu Thọ - Đà Nẵng,2363785888,Đà Nẵng,Multibrand,PJICO
176,178,CÔNG TY CỔ PHẦN Ô TÔ QUANG PHI HÙNG,CÔNG TY CỔ PHẦN Ô TÔ QUANG PHI HÙNG,"Lô B1, KDC Số 3, đường Nguyễn Hữu Thọ - Đà Nẵng",2363698888,Đà Nẵng,Multibrand,PJICO
177,179,CÔNG TY TNHH CKN Ô TÔ & DVTH KHÁNH HÀ,CÔNG TY TNHH CKN Ô TÔ & DVTH KHÁNH HÀ,74 - Hoàng Văn Thái - Đà Nẵng,2363708191,Đà Nẵng,Multibrand,PJICO
178,180,CÔNG TY TNHH THIÊN PHÚ BÌNH,CÔNG TY TNHH THIÊN PHÚ BÌNH,"202 Huỳnh Ngọc Huệ, Phường An Khê, Quận Thanh Khê, Đà Nẵng",2363708191,Đà Nẵng,Multibrand,PJICO
179,181,CÔNG TY TNHH MTV Ô TÔ NAM BÌNH,CÔNG TY TNHH MTV Ô TÔ NAM BÌNH,395 - Nguyễn Tất Thành - Đà Nẵng,2363531686,Đà Nẵng,Multibrand,PJICO
180,182,CÔNG TY CP KỸ THUẬT VÀ Ô TÔ TRƯỜNG LONG CN MIỀN TRUNG,CÔNG TY CP KỸ THUẬT VÀ Ô TÔ TRƯỜNG LONG CN MIỀN TRUNG,"QL1A - xã Hòa Châu, huyện Hòa Vang, Tp Đà Nẵng",906720101,Đà Nẵng,Multibrand,PJICO
