,Unnamed: 0,Company,Name Gara,Address,Phone,Province,Brand,Liên kết
2068,2149,Garage Ô tô Anh Tuấn,Garage Ô tô Anh Tuấn,"QL 30, xã An Bình, Huyện Cao Lãnh, Đồng Tháp",,Đồng Tháp,Multibrand,Xuân Thành
2069,2150,Gara Huy Vũ,Gara Huy Vũ,"183 Đạo Thạnh, TP Mỹ Tho, Tiền Giang",,Đồng Tháp,Multibrand,Xuân Thành
2070,2151,Công ty CP TM XNK Mỹ Phú Hưng,Công ty CP TM XNK Mỹ Phú Hưng,"318, Quốc Lộ 30, Phường Mỹ Phú, TP Cao Lãnh, Đồng Tháp",0673.870.899,Đồng Tháp,Multibrand,Xuân Thành
2071,2152,Garage Hạnh Phúc,Garage Hạnh Phúc,"88A, QL 80, Khóm Hòa Khánh, Phường 2, TX Sa Đéc, Đồng Tháp",,Đồng Tháp,Multibrand,Xuân Thành
2072,2153,Garage Ô Tô Khoa Quân,Garage Ô Tô Khoa Quân,"479, Quốc Lộ 30, Xã Anh Bình, TX Hồng Ngự, Đồng Tháp",,Đồng Tháp,Multibrand,Xuân Thành
2073,2154,Công ty TNHH Phú Khang,Công ty TNHH Phú Khang,"16/48 Trần Hưng Đạo , P. Mỹ Thạnh, TP Long Xuyên, An Giang",,An Giang,Multibrand,Xuân Thành
2074,2155,Toyota Cần Thơ,Toyota Cần Thơ,"1492/75 QL 91,P.Bình Đức, Tp Long Xuyên, An Giang",713919919,An Giang,Toyota,Xuân Thành
2075,2156,CONG TY TNHH MTV O TO TRUONG HAI AN GIANG,THACO AN GIANG,"2291-2201 Trần Hưng Đạo, P. Mỹ Thới,
 TP. Long Xuyên, T. An Giang",763942369,An Giang,Kia,Liberty
2076,2157,CONG TY CP DT VA TM TAY OTO - CN WESTERN FORD AN GIANG,Ford An Giang,"26/2A Trần Hưng Đạo, P. Mỹ Thới, Long Xuyên, An Giang",2963933101,An Giang,Ford,Liberty
2077,2158,CONG TY TNHH TOYOTA CAN THO - CN AN GIANG,TOYOTA CAN THO - CN AN GIANG,"1785 Trần Hưng Đạo, Phường Mỹ Quý, TP. Long Xuyên, An Giang",2963818818,An Giang,Toyota,Liberty
2078,2159,CONG TY CP TOYOTA VUNG TAU,"Toyota Vũng
 Tàu","168 Đường 3/2, P.10, Vũng Tàu",643627888,Bà Rịa-Vũng Tàu,Toyota,Liberty
2079,2160,CONG TY CP TM DV XE HOI VUNG TAU,"Xe Hơi Vũng
 Tàu","688 Trương Công Định, Vũng Tàu",2543551789,Bà Rịa-Vũng Tàu,Multibrand,Liberty
2080,2161,CTY CP THUONG MAI THANH THANH PHAT - CN VUNG TAU,Chevrolet - Vinfast Bà Rịa,"Quốc Lộ 51A, P. Phước Trung, Bà Rịa","064 3717131
 '064 3717130",Bà Rịa-Vũng Tàu,Chevrolet,Liberty
2081,2162,CTY CP CITY AUTO CN BA RIA,City Ford - CN Bà Rịa,"Quốc Lộ 51A, P. Phước Trung, Bà Rịa","064 3717131
 '064 3717130",Bà Rịa-Vũng Tàu,Ford,Liberty
2082,2163,CTY CO PHAN VUNG TAU TRUONG HAI,"THACO Vũng
 Tàu","Địa điểm 1: Quốc Lộ 51, Phước Trung, Bà Rịa, Bà Rịa Vũng Tàu
 Địa điểm 2: 426 THỐNG NHẤT MỚI,
 P.8, TP. VŨNG TÀU.",0254 3711 722,Bà Rịa-Vũng Tàu,Kia,Liberty
2083,2164,CTY CP CITY AUTO CN VUNG TAU,"City Ford - CN
 Vũng Tàu","40A, đường 30/4,pPhường 9, TP.
 Vũng Tàu",0643.594 777,Bà Rịa-Vũng Tàu,Ford,Liberty
2084,2165,CTY TNHH O TO NGOC PHUONG,Hyundai Bà Rịa,"611 Quốc Lộ 51, P. Long Hương, Bà
 Rịa",02.543.741.777,Bà Rịa-Vũng Tàu,Hyundai,Liberty
2085,2166,CTY TNHH RONG VIET,Ô tô Rồng Việt,"Số 42, đường 30/4, phường 9, TP
 Vũng Tàu","0933 65 99 39 -
 Mr Ngọc // 0898 666 088",Bà Rịa-Vũng Tàu,Multibrand,Liberty
2086,2167,CONG TY TNHH MTV O TO TRUONG HAI BAC GIANG,"THACO Bắc
 Giang","Cụm công nghiệp Dĩnh Kế, xã Dĩnh
 Kế, TP Bắc Giang, Bắc Giang",02.043.993.332,Bắc Giang,Kia,Liberty
2087,2168,CONG TY CP KINH DOANH VA DICH VU TOYOTA BAC GIANG,TOYOTA BAC GIANG,"Thôn Riễu, Xã Dĩnh Trì, Thành Phố Bắc Giang, Tỉnh Bắc Giang",868533933,Bắc Giang,Toyota,Liberty
2088,2169,CTY TNHH MTV BAC NINH TRUONG HAI,"THACO Bắc
 Ninh","Lô 4 & 15 Cụm CN Võ Cường, P. Võ
 Cường, TP Bắc Ninh",2223692818,Bắc Ninh,Mazda,Liberty
2089,2170,CTY TNHH TOYOTA BAC NINH,Toyota Bắc Ninh,"Lô A, Đường Lê Thái Tổ, P. Võ
 Cường, TP. Bắc Ninh",2413686666,Bắc Ninh,Toyota,Liberty
2090,2171,CTY TNHH DAU TU XAY DUNG VA TM PHUONG THAO PHAT,Hyundai Bắc Ninh,"Đường Lê Thái Tổ, Khu Hòa Đình , Phường Võ Cường, Thành phố Bắc Ninh, Tỉnh Bắc Ninh, Việt Nam",02.223.817.777,Bắc Ninh,Hyundai,Liberty
2091,2172,CÔNG TY TNHH HAN NAM,HONDA BẮC NINH,"số 39, đường Lý Thái Tổ, Phường Võ
 Cường, TP Bắc Ninh, Bắc Ninh",2223686666,Bắc Ninh,Honda,Liberty
2092,2173,CONG TY TNHH DUONG TUAN,KIA BAC NINH,"Đường Lê Thái Tổ, Phường Võ Cường, Thành phố Bắc Ninh, Tỉnh Bắc Ninh",2416515151,Bắc Ninh,Kia,Liberty
2093,2174,CONG TY TNHH O TO BAC NINH,MITSUBISHI BAC NINH,"Đường Lê Thái Tổ, Phường Võ Cường, Thành phố Bắc Ninh, Tỉnh Bắc Ninh",2416515151,Bắc Ninh,Mitsubishi,Liberty
2094,2175,CONG TY TNHH MTV TOYOTA BINH DINH,Toyota Bình Định,"278A Nguyễn Thị Định, Qui Nhơn",563946717,Bình Định,Toyota,Liberty
2095,2176,CONG TY TNHH MTV O TO TRUONG HAI BINH DINH,THACO Bình Định,"236A Tây Sơn, Quy Nhơn",2563514112,Bình Định,Kia,Liberty
2096,2177,"CTY CO PHAN DANA, CN BINH DINH",Dana Ford Bình Định,"73 Tây Sơn, Quy Nhơn",2563546555,Bình Định,Ford,Liberty
2097,2178,CTY TNHH TAN THUONG LOI,"Gara Tân
 Thương Lợi","28 Đinh Công Tráng, Phường Nguyễn Văn Cừ, Thành phố Quy Nhơn, Tỉnh Bình Định","0Mr Vũ: 0983 991
 479 // 0935 991
 477",Bình Định,Multibrand,Liberty
2098,2179,CTY CO PHAN OTO BINH DINH,Hyundai Bình Định,"359 Tây Sơn, Quang Trung, Tp. Qui Nhơn, Bình Định",0(0256) 3535 688,Bình Định,Hyundai,Liberty
2099,2180,CTY TNHH TM VA DV OTO DUNG TIEN CN BINH DINH,Honda Bình Định,"Khu vực 5, đường Tây Sơn, Ghềnh Ráng, Quy Nhơn",563566666,Bình Định,Honda,Liberty
2100,2181,"CÔNG TY CỔ PHẦN Ô TÔ QUY
 NHƠN","MITSUBISHI
 BÌNH ĐỊNH","590 Tây Sơn, Phường Quang Trung,
 TP. Quy Nhơn, Bình Định",2563646999,Bình Định,Mitsubishi,Liberty
2101,2182,TIEN GARA,TIEN GARA XE TAI,"Tổ 52, Khu Vực 6, Phường Nhơn Bình, TP. Quy Nhơn, Tỉnh Bình Định",914036113,Bình Định,Truck,Liberty
2102,2183,CONG TY TNHH MOT THANH VIEN TRUONG HAI-BINH DUONG,THACO Bình Dương,"56/9 Đại Lộ Bình Dương, P. Bình
 Giao, TX Thuận An, Bình Dương",06.503.719.602,Bình Dương,Kia,Liberty
2103,2184,CTY TNHH MTV O TO TRUONG HAI BINH DUONG (TAI BUS),"THACO Lái
 Thiêu","3A Khóm Bình Hòa, TT. Lái Thiêu, H.
 Thuận An, Bình Dương",,Bình Dương,Kia,Liberty
2104,2185,CTY CP DV O TO THANH PHO MOI BINH DUONG,Ford Bình Dương,"Lô C13, đường Hùng Vương, P. Hòa
 Phú, Thủ Dầu Một, Bình Dương",06.503.801.381,Bình Dương,Ford,Liberty
2105,2186,CTY TNHH OTO BINH LAM,Ô tô Bình Lâm,"Cơ sở 1: 88A Trần Quốc Toản, KP. Bình Minh 1, P. Dĩ An, TX. Dĩ An , T. Bình Dương",915990779,Bình Dương,Multibrand,Liberty
2106,2187,CTY TNHH TM DV OTO HOA BINH MINH,Honda Bình Dương,"Thửa đất số 311, tờ bản đồ số 62(D2), khu phố Bình Đức 2, Phường Bình Hòa, Thị xã Thuận An,Bình Dương",2743763636,Bình Dương,Honda,Liberty
2107,2188,CONG TY CO PHAN NGUYEN GIA PHAT,GARAGE NGUYEN GIA PHAT,"109/12 Vĩnh Phú 38, Khu Phố Tây,
 Vĩnh Phú, Thuận An, Bình Dương",2743662113,Bình Dương,Multibrand,Liberty
2108,2189,CTY TNHH OTO NGOI SAO VIET NAM - CN BINH DUONG,"Mer. Ngôi Sao, Bình Dương","Số 4, The Canary, Đại lộ Bình Dương,
 P. Bình Hòa, TX Thuận An, Bình Dương",2743799633,Bình Dương,Mercedes,Liberty
2109,2190,CONG TY CO PHAN HYUNDAI NGUYEN GIA PHAT,HYUNDAI NGUYEN GIA PHAT,"số 39 Đại lộ Bình Dương, Phường Vĩnh Phú, TX Thuận An, Bình Dương",906919639,Bình Dương,Hyundai,Liberty
2110,2191,CONG TY TNHH DICH VU OTO NHAN VAN,GARAGE OTO NHAN VAN,"số 89, Đường M, Khu Nhị Đồng 2,
 Phường Dĩ An, TP Dĩ An, Bình Dương",969024286,Bình Dương,Multibrand,Liberty
2111,2192,CONG TY TNHH TM DV TAN THINH VUONG,GARAGE XE TAI TAN THINH VUONG,"Thửa đất số 133, tờ bản đồ 131, Khu phố 1A, P. An Phú, Thị xã Thuận An, Tỉnh Bình Dương",983124086,Bình Dương,Truck,Liberty
2112,2193,CTY TNHH O TO VIET THANH,Nissan Bình Dương,"24 Đại Lộ Bình Dương, Thuận An,
 Bình Dương",2743767885,Bình Dương,Nissan,Liberty
2113,2194,CTY TNHH SUA CHUA MUA BAN PHU TUNG O TO AN PHU,O TO AN PHU BINH DUONG,"4e/1 KP1B, phường An Phú, Thuận
 An, Bình Dương",274380094,Bình Dương,Multibrand,Liberty
2114,2195,CONG TY TNHH O TO QT,O TO QT,"63/1 đường An Thạnh 10, KP Thạnh Lộc, Phường An Thạnh, TP Thuận An, Bình Dương",901532131,Bình Dương,Multibrand,Liberty
2115,2196,CTY TNHH MTV TM- DV- VT TRUONG HAI BINH PHUOC,THACO Bình Phước,"684 Phú Riềng Đỏ, P. Tân Xuân, TX
 Đồng Xoài",2712211244,Bình Phước,Kia,Liberty
2116,2197,CTY CP DICH VU O TO THANH PHO MOI BINH DUONG - CN BINH PHUOC,FORD BINH DUONG - CN BINH PHUOC,"Đường Phú Riềng Đỏ, Phường Tân
 Phú,Đồng Xoài, Bình Phước",818777793,Bình Phước,Ford,Liberty
2117,2198,CTY TNHH DICH VU THUONG MAI O TO THINH PHAT,O TO THINH PHAT,"Đoàn Thị Điểm, KP Hưng Thịnh, P.
 Hưng Chiến, Bình Long, Bình Phước",867789839,Bình Phước,Multibrand,Liberty
2118,2199,"CN PHAN THIET, CTY CO PHAN OTO TRUONG HAI",THACO Phan Thiết,Thôn Thắng Lợi – Hàm Thắng - Hàm Thuận Bắc,2523739295,Bình Thuận,Kia,Liberty
2119,2200,CONG TY CO PHAN O TO BINH THUAN,MITSUBISHI BINH THUAN,"Lô 4/3 đường số 4, KCN Phan Thiết, Phong Nẫm, Phan Thiet, Bình Thuận",1900234569,Bình Thuận,Mitsubishi,Liberty
2120,2201,CONG TY CO PHAN DICH VU O TO BINH THUAN,FORD BINH THUAN,"Lô 4/3 đường số 4, KCN Phan Thiết, Phong Nẫm, Phan Thiet, Bình Thuận",1900234569,Bình Thuận,Ford,Liberty
2121,2202,CONG TY TNHH MTV THUONG MAI DICH VU O TO NAM BINH CA MAU,HYUNDAI CA MAU,"Quốc Lộ 1A, đường Nguyễn Tất Thành, xã Lý Văn Lâm, TP. Cà Mau, Tỉnh Cà Mau",2903858888,Cà Mau,Hyundai,Liberty
2122,2203,CONG TY TNHH THUONG MAI NGOC ANH,SUZUKI CA MAU,"144 đường Nguyễn Tất Thành,
 Phường 8, TP. Cà Mau, Tỉnh Cà Mau",888858201,Cà Mau,Suzuki,Liberty
2123,2204,CHI NHANH CONG TY TNHH TIEN PHAT,TIEN PHAT CA MAU,"Lô số 1, đường Vành Đai 2, Phường 9, TP Cà Mau",2903818999,Cà Mau,Kia,Liberty
2124,2205,CONG TY TNHH TOYOTA CAN THO,Toyota Cần Thơ,"K2-0 Võ Nguyên Giáp, Phú Thứ, Q.
 Cái Răng, Cần Thơ",713919919,Cần Thơ,Toyota,Liberty
2125,2206,CONG TY TNHH MTV O TO TRUONG HAI CAN THO,THACO Tay Do,"Đường Quang Trung, KDC Hưng Phú 1, P. Hưng Phú, Q. Cái Răng, Tp Cần Thơ",2923686869,Cần Thơ,Kia,Liberty
2126,2207,CTY TNHH MTV HIEN 68,Gara 68,"39 Võ Nguyên Giáp, KV Thạnh Thuận,
 P. Phú Thứ, Q. Cái Răng, Tp. Cần Thơ",0913.173 381,Cần Thơ,Multibrand,Liberty
2127,2208,CTY CP DT TM DV SAI GON O TO CAN THO,Cần Thơ Ford,"Lô 11C, Đường Võ Nguyên Giáp, P. Phú Thứ, Q. Cái Răng, TP.Cần Thơ",2923730720,Cần Thơ,Ford,Liberty
2128,2209,CTY TNHH TOYOTA NINH KIEU,Toyota Ninh Kiều,"57 CMT8, P. An Hòa, Ninh Kiều, Cần
 Thơ",2923756666,Cần Thơ,Toyota,Liberty
2129,2210,CONG TY TNHH OTO G-STAR,MITSUBISHI CẦN THƠ,"DH1-DH2, Võ Nguyên Giáp, P. Hưng
 Thạnh, Quận Cái Răng, TP Cần Thơ",2923943789,Cần Thơ,Mitsubishi,Liberty
2130,2211,CTY TNHH TMDV O TO TUAN LINH,O TO TUAN LINH - XE TAI,"1798/7 đường Võ Văn Kiệt, KV Bình
 Nhựt, P. Long Hòa, Q. Bình Thủy, Cần
 Thơ",2923508677,Cần Thơ,Multibrand,Liberty
2131,2212,CN CTY CP DICH VU O TO HANG XANH TAI TP CAN THO,HAXACO CAN THO,"102 Cách Mạng Tháng 8, Phường Cái Khế, Quận Ninh Kiều, Cần Thơ",2923656568,Cần Thơ,Mercedes,Liberty
2132,2213,CTY CP OTO VAN HOI MOI,"Honda Ô tô Đà
 Nẵng","Lô A11, Đường 2/9, Q. Hải Châu",5113788888,Đà Nẵng,Honda,Liberty
2133,2214,"CN CTY CP TRUYEN THONG VA DU LIEU THANH TOAN AN DU
 TAI DN","Mer. An Du, Đà Nẵng","113 Nguyễn Hữu Thọ, Q. Hải Châu,
 Đà Nẵng",2363785888,Đà Nẵng,Mercedes,Liberty
2134,2215,CONG TY CO PHAN DANA,Dana Ford,"194 Bế Văn Đàn, Q. Thanh Khê, Đà
 Nẵng",5113646555,Đà Nẵng,Ford,Liberty
2135,2216,CTY CP MAY THIET BI DAU KHI DA NANG,"Mitsubishi Đà
 Nẵng","51 Phan Đăng Lưu, Q. Thanh Khê",2363623438,Đà Nẵng,Mitsubishi,Liberty
2136,2217,CONG TY TNHH TRUONG HAI DA NANG,"THACO Đà
 Nẵng - Thanh Khê","356 Điện Biên Phủ, P. Thanh Khê
 Đông, Q. Thanh Khê",5113785555,Đà Nẵng,Peugeot,Liberty
2137,2218,"CN DA NANG XE THUONG MAI
 - CONG TY CP OTO TRUONG HAI",THACO THUONG MAI - HOA PHUOC,"Quá Giáng 1, Quốc Lộ 1A, xã Hòa
 Phước, H. Hòa Vang, Đà Nẵng",2363764495,Đà Nẵng,Kia,Liberty
2138,2219,CTY TNHH MTV TOYOTA DA NANG,Toyota Đà Nẵng,"151 Lê Đình Lý, Q. Thanh Khê, Đà
 Nẵng",5113614012,Đà Nẵng,Toyota,Liberty
2139,2220,CTY TNHH HOANG ANH LUC,Gara Hoàng Anh Lực,"112-114-116 Trịnh Đình Thảo, Quận Cẩm Lệ, Tp Đà Nẵng",905112767,Đà Nẵng,Multibrand,Liberty
2140,2221,CONG TY TNHH TRUONG HAI DA NANG,"THACO Đà
 Nẵng - Thanh Khê","Tổ 14, Đường Phạm Văn Đồng, P An Hải Bắc, Quận Sơn Trà, Đà Nẵng",5113785555,Đà Nẵng,Kia,Liberty
2141,2222,CONG TY TNHH OTO DA NANG,MITSUBISHI SAVICO DA NANG,"02 Nguyễn Hữu Thọ, P. Hòa Thuận Tây, Quận Hải Châu, Đà Nẵng",2363775888,Đà Nẵng,Mitsubishi,Liberty
2142,2223,CONG TY TNHH O TO THINH HUNG,VINFAST DA NANG,"Lô A2-2 KDC, Nút giao thông Tuyên Sơn, Đường 2/9, Phường Hòa Cường Nam, Quận Hải Châu, Đà Nẵng",911858000,Đà Nẵng,Vinfast,Liberty
2143,2224,CTY CP OTO SONG HAN,"Hyundai Sông
 Hàn","86 Duy Tân, Q. Hải Châu",5113783555,Đà Nẵng,Hyundai,Liberty
2144,2225,CONG TY TNHH O TO TIEN THU DA NANG,HONDA O TO TIEN THU DA NANG,"147 Phạm Hùng, P.Hoà Xuân, Q. Cẩm lệ, TP Đà Nẵng",2363227579,Đà Nẵng,Honda,Liberty
2145,2226,CONG TY TNHH MTV O TO SON TRA,HYUNDAI SON TRA,"286 Phạm Hùng, xã Hòa Phước, huyện Hòa Vang, TP Đà Nẵng",2363773555,Đà Nẵng,Hyundai,Liberty
2146,2227,CONG TY CP DAU TU O TO KIM SON,SUBARU DA NANG,"1122 Ngô Quyền, Phường An Hải Tây, Quận Sơn Trà, TP Đà Nẵng",931199007,Đà Nẵng,Subaru,Liberty
2147,2228,CONG TY TNHH TOYOTA OKAYAMA DA NANG,TOYOTA OKAYAMA,"số 9 Phạm Hùng, Phường Hòa Xuân, Quận Cẩm Lệ, TP Đà Nẵng",2363525668,Đà Nẵng,Toyota,Liberty
2148,2229,CONG TY TNHH MTV O TO TRUONG HAI DAK NONG,THACO DAK NONG,"Quốc lộ 14, Tổ Dân Phố 6, Phường Nghĩa Phú, TP Gia Nghĩa, Tỉnh Đắk Nông,",2616526777,Đắk Nông,Kia,Liberty
2149,2230,CONG TY TNHH O TO CONG THANH,"Chevrolet Công
 Thành","84 Y Bih Alêô, Buôn Ma Thuột",0262 3 954 979,Đắk Lắk,Chevrolet,Liberty
2150,2231,CONG TY TNHH OTO TAY NGUYEN,Daklak Ford,"35A Trường Chinh, Buôn Ma Thuột",2623954999,Đắk Lắk,Ford,Liberty
2151,2232,CTY TNHH O TO HYUNDAI HOANG VIET,HYUNDAI DAKLAK,"15A Nguyễn Chí Thanh, P. Tân An,
 TP. Buôn Ma Thuột, Daklak",5008556789,Đắk Lắk,Hyundai,Liberty
2152,2233,CTY TNHH CONG NGHIEP OTO DAKLAK,Mitsubishi Daklak,"144 Nguyễn Chí Thanh, P.Tân An,
 Buôn Ma Thuột,Đak Lak",5003877567,Đắk Lắk,Mitsubishi,Liberty
2153,2234,CTY TNHH THUONG MAI TAN LOAN,Honda Daklak,"Số 145 đường Nguyễn Chí Thanh, Phường Tân An, TP.Buôn Ma Thuột, Tỉnh Đắk Lắk",0500 386 0 888,Đắk Lắk,Honda,Liberty
2154,2235,CONG TY CO PHAN VO XE NAM CHAU DUY NHAT,Nissan Dak Lak,"135A Lê Thị Hồng Gấm, Buôn Ma
 Thuột, Dak Lak",050 03 75 79 79,Đắk Lắk,Nissan,Liberty
2155,2236,CONG TY TNHH TOYOTA BUON MA THUOT,"Toyota Buôn Ma
 Thuột","29 Trường Chinh, Buôn Ma Thuột",2623953344,Đắk Lắk,Toyota,Liberty
2156,2237,CONG TY TNHH O TO MAZDA TRUONG LINH,MAZDA TRUONG LINH,"38 Nguyễn Chí Thanh, P.Tân An, TP.
 Buôn Ma Thuột, DakLak",2623813135,Đắk Lắk,Mazda,Liberty
2157,2238,CTY TNHH TRUONG LINH,THACO TRUONG LINH - DAKLAK,"số 19 Nguyễn Tất Thành, Phường Tân Lợi, TP Buôn Ma Thuột, Daklak",2623900099,Đắk Lắk,Multibrand,Liberty
2158,2239,CTY TNHH XUAT NHAP KHAU O TO TAY NGUYEN,SUZUKI DAKLAK,"114 Nguyễn Chí Thanh, Phường Tân
 An, TP Buôn Ma Thuột, Daklak",2623698798,Đắk Lắk,Suzuki,Liberty
2159,2240,CONG TY CO PHAN O TO THANH TRUNG,"THACO
 DAKLAK - XE TAI","97A Nguyễn Văn Linh, P. Tân An, Buôn Ma Thuột, Daklak",2623953077,Đắk Lắk,Kia,Liberty
2160,2241,CONG TY CO PHAN TOYOTA DAKLAK,TOYOTA DAKLAK,"167 Nguyễn Thái Bình, xã Hòa Thắng,
 TP. Buôn Ma Thuột, DakLak",889047047,Đắk Lắk,Toyota,Liberty
2161,2242,CONG TY CO PHAN AN PHUOC AUTO,JEEP BUON MA THUOT,"03 Trần Nhật Duật, Phường Tân Lợi,
 TP. Buôn Ma Thuột, Đà Nẵng",2623950777,Đắk Lắk,Jeep,Liberty
2162,2243,CTY TNHH DV TM TAN PHAT DAT,Ford Đồng Nai,"số B04, Kp3, Khu Thương Mại Amata,
 Phường Long Bình, Biên Hòa, Đồng Nai","0251 2223380
 3857130",Đồng Nai,Ford,Liberty
2163,2244,CONG TY TNHH O TO BAC QUANG,Mitsubishi Bắc Quang,"Đường Số 1, KCN Biên Hòa, Biên Hòa",2513835531,Đồng Nai,Mitsubishi,Liberty
2164,2245,CONG TY TNHH OTO NGOC PHAT,Hyundai Ngoc phat,"26/6 KP1, P. Bửu Long, Biên Hòa,
 Đồng Nai",5613824455,Đồng Nai,Hyundai,Liberty
2165,2246,CONG TY TNHH MTV O TO TRUONG HAI DONG NAI,THACO Biên Hòa,"Số 19, Đường 2A, KCN Biên Hòa II, Biên Hòa",613891726,Đồng Nai,Kia,Liberty
2166,2247,"CTY TNHH MTV SAN XUAT
 OTO CHUYEN DUNG TRUONG HAI","THACO Biên
 Hòa (Chuyên dụng)","8 Đường 2A, KCN Biên Hòa 2, Đồng Nai",0933.805.999,Đồng Nai,Kia,Liberty
2167,2248,CTY TNHH TM DV O TO KIM SON,Chevrolet Biên Hòa,"643 Quốc Lộ 1, KP2, P. Long Bình, Biên Hòa, Đồng Nai",02.518.877.898,Đồng Nai,Chevrolet,Liberty
2168,2249,CTY TNHH TM DV O TO KIM SON,Chevrolet Biên Hòa,"643 Quốc Lộ 1, KP2, P. Long Bình, Biên Hòa, Đồng Nai",02.518.877.898,Đồng Nai,Nissan,Liberty
2169,2250,CN2 - CONG TY TNHH OTO NGOC PHAT,CN2 - HYUNDAI NGOC PHAT,"D22, Xa Lộ Hà Nội, Phường Long
 Bình, TP Biên Hòa, Đồng Nai",2513891189,Đồng Nai,Hyundai,Liberty
2170,2251,CONG TY TNHH OTO LOC TAN PHAT,ISUZU LOC TAN PHAT,"số 578, Khu Phố 4, Phường Tân Hiệp,
 Biên Hòa, Đồng Nai",2513857799,Đồng Nai,Isuzu,Liberty
2171,2252,CONG TY TNHH NAM VIET AUTO,NAM VIET AUTO,"Số 1 Bis, Đường 16A, KCN Biên Hòa
 II, P An Bình, Tp. Biên Hòa",0251 3682 377,Đồng Nai,Multibrand,Liberty
2172,2253,CONG TY TNHH O TO VIET NHAT,SUBARU DONG NAI,"số 22A Xa Lộ Hà Nội, KP 5B, Tân Hiệp, Biên Hòa, Đồng Nai",2513889759,Đồng Nai,Subaru,Liberty
2173,2254,CONG TY TNHH MTV THUONG MAI O TO BIEN HOA,GARAGE O TO BIEN HOA,"19 Trương Định, Phường Tân Mai,
 Biên Hòa, Đồng Nai",2513894268,Đồng Nai,Multibrand,Liberty
2174,2255,CONG TY TNHH O TO HYUNDAI THAI SON,O TO THAI SON,"36/68 Đồng Khởi, Tổ 28, KP2, Phường Trảng Dài, TP Biên Hòa, Đồng Nai",917817875,Đồng Nai,Multibrand,Liberty
2175,2256,CTY TNHH TM NGOC HOA,Kia Gia Lai,"93-95-97 Trường Chinh, Pleiku",2693746179,Gia Lai,Kia,Liberty
2176,2257,CTY CP DANA CHI NHANH GIA LAI,Ford Gia Lai,"284 Lê Duẩn, Phường Thắng Lợi, Thành phố Pleiku, Gia Lai",593535555,Gia Lai,Ford,Liberty
2177,2258,CONG TY TNHH TOYOTA GIA LAI,Toyota Gia Lai,"542 Trường Chinh, P. Chi Lăng, TP.
 Pleiku, Tỉnh Gia Lai",0359 3879 777,Gia Lai,Toyota,Liberty
2178,2259,CTY TNHH MTV O TO GIA LAI,Hyundai Gia Lai,"278 Lê Duẫn, P. Thắng Lợi, Pleiku, Gia Lai",0593.862.255,Gia Lai,Hyundai,Liberty
2179,2260,CTY TNHH MTV TRUONG HAI HA NAM,THACO Hà Nam,"Km số 4, Quốc Lộ 1A, Thôn Đại Cầu, Xã Tiên Tân, TP Phủ Lý, Hà Nam",2263576888,Hà Nam,Kia,Liberty
2180,2261,CTY CP KINH DOANH O TO THU DO,Ford Thủ Đô,"Km 8 Giải Phóng, Pháp Vân, Q. Hoàng Mai",2436811888,Hà Nội,Ford,Liberty
2181,2262,CTY CP DT KD TONG HOP D VA C,Honda Ô tô Mỹ Đình,"Số 2, Lê Đức Thọ, Cầu Giấy",2437631838,Hà Nội,Honda,Liberty
2182,2263,CTY CP DAU TU VA TM HOA BINH MINH,"Hyundai Hà
 Đông","Do Lộ, Yên Ngĩa, Hà Đồng",2435379871,Hà Nội,Hyundai,Liberty
2183,2264,CTY CP DAU TU THUONG MAI QUANG DUC,Ô tô Quang Đức,"1075 Giải Phóng, Hoàng Mai, Hà Nội","024 3642 1622/
 3642 1626",Hà Nội,Multibrand,Liberty
2184,2265,CTY TNHH TOYOTA HA DONG,Toyota Hà Đông,"số 977 - 979, đường Quang Trung kéo dài, phường Yên Nghĩa, quận Hà Đông, HN",0433535858/ 0947187777,Hà Nội,Toyota,Liberty
2185,2266,CONG TY CP VOLKSWAGEN HA NOI,Volkswagen Hà Nội,"Số 3, lô 3 + 5, Nguyễn Văn Linh, Gia
 Thuỵ, Long Biên, HN",024 3 817 8989,Hà Nội,Volkswagen,Liberty
2186,2267,CONG TY TNHH TM VA DV O TO BAC VIET,Hyundai Bắc Việt,"467 Nguyễn Văn Linh, P.Phúc Đồng, Long Biên",2438757227,Hà Nội,Hyundai,Liberty
2187,2268,CONG TY TNHH MTV O TO TRUONG HAI LONG BIEN - HA NOI,BMW Long Biên,"01 Ngô Gia Tự, Long Biên, HN",,Hà Nội,Bmw,Liberty
2188,2269,CN NGUYEN VAN CU CTY CP O TO TRUONG HAI,Thaco Lê Duẩn,"132 Lê Duẩn, P Nguyễn Du, Q Hai Bà
 Trưng, TP Hà Nội",,Hà Nội,Peugeot,Liberty
2189,2270,CTY TNHH MTV O TO TRUONG HAI PHAM VAN DONG - HA NOI,"Thaco Phạm
 Văn Đồng","Lô CC2, Khu đô thị Thành phố Giao
 Lưu, Phường Cổ Nhuế 1, Quận Bắc Từ Liêm",24373050068,Hà Nội,Kia,Liberty
2190,2271,CONG TY TNHH KINH DOANH O TO NISU,Isuzu NISU,"Tòa Nhà Công Ty 22, Bộ Quốc Phòng,
 Sài Đồng",48772953,Hà Nội,Isuzu,Liberty
2191,2272,CTY TNHH TM VA DV O TO NGOC KHANH,Hyundai Ngọc Khánh,"Số 217 - 219, Phạm Văn Đồng, Xuân
 Đỉnh, Từ Liêm",2437557957,Hà Nội,Hyundai,Liberty
2192,2273,CONG TY CP DAU TU THUONG MAI AN DAN HA NOI,Mitsubishi An Dân,"Số 1 Nguyễn Văn Linh, Phường Gia Thụy, Long Biên, HN",2436503116,Hà Nội,Mitsubishi,Liberty
2193,2274,CTY CP XAY DUNG VA VAT TU THIET BI,KIA Giải Phóng,"Km 10 Đường Giải Phóng, Xã Tứ Hiệp, Thanh Trì",2436815340,Hà Nội,Kia,Liberty
2194,2275,CTY TNHH TOYOTA LONG BIEN,Toyota Long Biên,"7-9 Nguyễn Văn Linh, P . Gia Thụy, Q. Long Biên",2462777999,Hà Nội,Toyota,Liberty
2195,2276,CTY CO PHAN OTO THANH AN,Hyundai Long Biên,"Số 1, Nguyễn Văn Linh, P. Gia Thụy,
 Q. Long Biên",2438736097,Hà Nội,Hyundai,Liberty
2196,2277,CTY TNHH TOYOTA GIAI PHONG - CHI NHANH PHAP VAN,Toyota Giải Phóng,"Tổ 10 Pháp Vân, P. Hoàng Liệt, Q. Hoàng Mai, HN",436640124,Hà Nội,Toyota,Liberty
2197,2278,CTY TNHH TM VA DV O TO VIVA,Mazda Láng Hạ,"103 Phố Láng Hạ, Láng Hạ, Đống Đa,
 Hà Nội",2462685588,Hà Nội,Mazda,Liberty
2198,2279,CONG TY CO PHAN OTO LONG BIEN,Honda Long Biên,"477 Nguyễn Văn Linh, Phúc Đồng, Long Biên",2438756666,Hà Nội,Honda,Liberty
2199,2280,CONG TY TNHH MTV O TO TRUONG HAI THANH XUAN - HA NOI,Peugeot Thanh Xuân,"Số 12 Khuất Duy Tiến, P Thanh Xuân Trung, Q Thanh Xuân, Tp Hà Nội",024 7306 9026,Hà Nội,Peugeot,Liberty
2200,2281,CN THANH TRI CTY CP OTO TRUONG HAI,Mazda Giải Phóng (Thaco Thanh Trì),"km 12, Ngọc Hồi, Huyện Thanh Trì",436866473,Hà Nội,Mazda,Liberty
2201,2282,CONG TY TNHH MTV O TO TRUONG HAI LONG BIEN - HA,PEUGEOT LONG BIÊN,"541 Nguyễn Văn Cừ, P Gia Thụy, Q Long Biên, TP Hà Nội",938908280,Hà Nội,Peugeot,Liberty
2202,2283,CTY TNHH MTV CO KHI CHUYEN DUNG BAC BO TRUONG HAI,THACO Chuyên Dụng Bắc Bộ- Trường Hải,"Lô D6 KCN Hà Nội - Đài Tư, 386 Nguyễn Văn Linh, Sài Đồng, Long Biên, Hà Nội",0933.805.608,Hà Nội,Kia,Liberty
2203,2284,CN GIAI PHONG CTY CP O TO TRUONG HAI,"THACO Giải Phóng, truck",KM 10 Đường Giải Phóng – X. Tứ Hiệp – H. Thanh Trì - Hà Nội,,Hà Nội,Kia,Liberty
2204,2285,CTY TNHH MOT THANH VIEN TOYOTA MY DINH,Toyota Mỹ Đình,"15 Phạm Hùng, P. Mỹ Đình 2, Q. Nam
 Từ Liêm",043.768.666,Hà Nội,Toyota,Liberty
2205,2286,"CTY TNHH MTV TOYOTA MY DINH, CN CAU DIEN","Toyota Mỹ Đình
 - CN Cầu Diễn","số 10, Km10+600, Quốc Lộ 32, Thị trấn Cầu Diễn, H. Từ Liêm",437645566,Hà Nội,Toyota,Liberty
2206,2287,CTY CP DAU TU THUONG MAI AN DO,Ford An Đô,"CT3, Lô C1, Phạm Văn Đồng, Xuân
 Đỉnh, Từ Liêm",2437505055,Hà Nội,Ford,Liberty
2207,2288,CONG TY TNHH O TO VIET PHAT,Nissan Hà Đông,"Km số 14 + 600 Quốc lộ 6, Yên Nghĩa, Hà Đông",2433571208,Hà Nội,Nissan,Liberty
2208,2289,CTY TNHH MOT THANH VIEN KINH DOANH O TO THANG LONG,"Ford Thăng
 Long","105 Láng Hạ, Q. Đống Đa",2438561454,Hà Nội,Ford,Liberty
2209,2290,CTY TNHH TOYOTA THANH XUAN,Toyota Thanh Xuân,"315 Trường Chinh, P. Khương Mai, Q.
 Thanh Xuân, Hà Nội",0435.656.666,Hà Nội,Toyota,Liberty
2210,2291,CONG TY CO PHAN GM THANG LONG,"Chevrolet Thăng
 Long","Số 68, Trịnh Văn Bô, P. Phương
 Canh, Q. Nam Từ Liêm, Hà Nội",0247 300 88 66,Hà Nội,Chevrolet,Liberty
2211,2292,CTY TNHH MTV KINH DOANH O TO THANH XUAN,Ford Thanh Xuân,"88 Nguyễn Xiển, Hạ Đình, Q. Thanh
 Xuân",0435.525.525,Hà Nội,Ford,Liberty
2212,2293,CTY TNHH MTV KINH DOANH VA DICH VU OTO HA NOI,Ford Hà Nội,"311-313 Trường Chinh, Thanh Xuân, Hà Nội",2439712439,Hà Nội,Ford,Liberty
2213,2294,CTY CP HA THANH O TO,Ford Hà Thành,"Cụm công nghiệp Lai Xá, Kim Chung,
 Hoài Đức, Hà Nội",2433662566,Hà Nội,Ford,Liberty
2214,2295,CTY CP TRUYEN THONG VA DL THANH TOAN AN DU,Mercedes An Du,"11 Phạm Hùng, Mỹ Đình, Từ Liêm",2437686762,Hà Nội,Mercedes,Liberty
2215,2296,CTY TNHH TM DICH VU CO KHI OTO VIET DANG,HINO Việt Đăng,"Km3, Phan Trọng Tuệ, Xã Tam Hiệp,
 Thanh Trì, Hà Nội",024 3687 3150,Hà Nội,Hino,Liberty
2216,2297,CN CTY CP DV O TO HANG XANH TAI HA NOI,Haxaco Hà Nội,"46 Láng Hạ, P. Láng Hạ, Q. Đống Đa,
 Hà Nội",2437644646,Hà Nội,Mercedes,Liberty
